name,brand,notes,citrus,woody,fresh_spicy,sweet,fruity
Chanel Naxos Uomo,Chanel,cashmeran rosewood birch pear,6,25,9,4,56
Creed Stronger With You Blanche,Creed,amberwood black_cherry neroli coriander cloves,17,12,14,9,48
Roja Parfums Mojave Ghost Sport,Roja Parfums,pink_pepper nutmeg peach brown_sugar,10,8,23,40,19
Prada Herod Limited Edition,Prada,mandarin_orange cedarwood dried_fruits,11,27,10,7,45
Maison Margiela Ani Noir,Maison Margiela,blackcurrant grapefruit blackberry,32,8,1,4,55
Giorgio Armani Aventus Eau de Parfum,Giorgio Armani,amberwood coconut,10,34,4,1,51
Roja Parfums Ultra Male Night,Roja Parfums,mandarin_orange apricot ginger coconut coriander tonka_bean blood_orange caramel,37,3,20,11,29
Byredo Cedrat Boise Limited Edition,Byredo,amberwood guaiac_wood fig coriander dried_fruits,3,44,15,10,28
Lancome Terre Uomo,Lancome,papyrus cacao cardamom,2,31,35,28,4
Nishane Le Beau Extreme,Nishane,honey yuzu neroli saffron tonka_bean,21,8,42,26,3
Kilian Hacivat Privé,Kilian,marshmallow black_cherry nutmeg amber oud lime black_pepper bergamot apple,14,22,20,19,25
Tom Ford Sedley Elixir,Tom Ford,amberwood neroli mandarin,51,22,9,10,8
Gucci Pegasus Elixir,Gucci,pink_pepper yuzu agarwood melon,16,39,23,6,16
Byredo Alien Limited Edition,Byredo,cacao pepper raspberry yuzu blackcurrant birch cashmeran,26,14,24,25,11
Roja Parfums Jadore Extreme,Roja Parfums,mandarin_orange wax pepper green_apple neroli sichuan_pepper,25,6,11,41,17
Dolce & Gabbana Oud Wood Extreme,Dolce & Gabbana,honey patchouli lime fig blood_orange cashmeran,39,17,0,12,32
Prada By the Fireplace Intense,Prada,yuzu pear bourbon_vanilla peach grapefruit praline,27,7,0,32,34
Chanel Man Eau Fraiche Eau de Parfum,Chanel,apricot cardamom sichuan_pepper,4,4,63,9,20
Creed Neroli Portofino Extreme,Creed,lavender oud coconut saffron apple,0,56,23,1,20
Giorgio Armani Love Dont Be Shy Night,Giorgio Armani,neroli black_cherry blood_orange,22,8,8,3,59
Gucci Cedrat Boise Parfum,Gucci,oakmoss guaiac_wood mandarin blackcurrant pink_pepper brown_sugar,21,21,22,24,12
Versace Bleu Cologne,Versace,peach yuzu praline,22,3,9,30,36
Roja Parfums Black Phantom Gold,Roja Parfums,oakmoss lavender cedarwood rosewood blackberry,0,18,24,1,57
Lancome Reflection Parfum,Lancome,iso_e_super sandalwood mandarin cedarwood yuzu peach plum,56,20,10,1,13
Jean Paul Gaultier Black Opium Limited Edition,Jean Paul Gaultier,lemon,80,7,2,6,5
Initio Parfums No 5 Eau de Parfum,Initio Parfums,neroli agarwood lime cacao,35,21,6,37,1
Amouage Black Phantom Blanche,Amouage,chocolate sage cinnamon plum grapefruit apple,20,2,47,14,17
Dolce & Gabbana Side Effect Parfum,Dolce & Gabbana,amberwood lemon pepper petitgrain ebony_wood praline,38,19,19,15,9
Roja Parfums By the Fireplace Donna,Roja Parfums,marshmallow patchouli yuzu petitgrain bourbon_vanilla peach blackberry,35,24,4,13,24
Bvlgari L'Homme Gold,Bvlgari,amberwood honey mango cedarwood green_apple licorice ambergris,3,17,6,14,60
Giorgio Armani Eros Extreme,Giorgio Armani,marshmallow black_cherry oakmoss guaiac_wood raspberry cedar licorice,1,48,9,11,31
Mancera Santal 33 Gold,Mancera,black_pepper neroli cumin plum blood_orange blackberry,61,8,11,3,17
Gucci La Nuit de L'Homme Noir,Gucci,papyrus lemon coffee blackcurrant blackberry,21,45,1,16,17
Byredo Fucking Fabulous Blanche,Byredo,coconut blood_orange lavender,34,2,48,0,16
Montale Le Beau Blanche,Montale,papyrus neroli iso_e_super black_pepper,14,33,43,10,0
Versace Reflection Parfum,Versace,pepper guaiac_wood orange chocolate oud bourbon_vanilla melon,23,21,19,21,16
Hermes Alien Extreme,Hermes,honey iso_e_super chocolate oud birch,4,27,6,63,0
Parfums de Marly Fucking Fabulous Intense,Parfums de Marly,cedar yuzu bergamot ebony_wood praline blackberry caramel,13,31,1,40,15
Lancome Man Eau Fraiche Eau de Parfum,Lancome,sour_cherry raspberry petitgrain,51,5,3,6,35
Montale Pegasus Privé,Montale,mandarin_orange amberwood black_cherry pepper guaiac_wood cedarwood brown_sugar tonka_bean,14,15,36,15,20
Mancera Millessime Imperial Limited Edition,Mancera,pink_pepper pineapple blackberry birch,9,20,41,5,25
Prada Interlude Intense,Prada,wax oud licorice cinnamon birch,2,39,21,28,10
Initio Parfums Layton Sport,Initio Parfums,honey black_cherry cloves,4,5,30,44,17
Prada Tygar Uomo,Prada,mandarin_orange lemon amber sage pink_pepper peach,44,10,14,12,20
Paco Rabanne Black Orchid Uomo,Paco Rabanne,amberwood apple mandarin oud pineapple caramel,40,24,10,14,12
Yves Saint Laurent Layton Donna,Yves Saint Laurent,orange amber mint cherry_liqueur blood_orange,45,1,11,15,28
Amouage No 5 Noir,Amouage,papyrus mango yuzu ginger bergamot coriander,15,19,49,3,14
Prada Oud for Greatness Uomo,Prada,mandarin_orange oud cumin vetiver cashmeran,12,47,30,7,4
Paco Rabanne Hacivat Intense,Paco Rabanne,guaiac_wood cedarwood cherry_liqueur tonka_bean ambergris vanilla blackberry,2,23,9,29,37
Gucci Sedley Gold,Gucci,cacao pepper chocolate blackcurrant cumin grapefruit blood_orange,15,4,29,39,13
Dior Terre Extreme,Dior,orange bourbon_vanilla sichuan_pepper melon,14,8,19,45,14
Hermes Aventus Night,Hermes,cedarwood iso_e_super birch bergamot,45,41,0,5,9
Paco Rabanne Layton Limited Edition,Paco Rabanne,amber pink_pepper ebony_wood tonka_bean birch cloves,8,21,37,27,7
Xerjoff Black Orchid Absolute,Xerjoff,ambergris yuzu sichuan_pepper bergamot,35,44,15,5,1
Maison Margiela Rehab Intense,Maison Margiela,apricot grapefruit lemon pepper,14,6,32,8,40
Chanel Jubilation Privé,Chanel,mandarin_orange peach praline guaiac_wood,17,29,5,23,26
Tom Ford Bleu Night,Tom Ford,orange sour_cherry petitgrain,11,5,6,6,72
Giorgio Armani Stronger With You Parfum,Giorgio Armani,patchouli oud iso_e_super wax,9,36,5,49,1
Prada Y Le Parfum Donna,Prada,apricot yuzu coconut ambergris vetiver,11,70,3,2,14
Roja Parfums Oajan Parfum,Roja Parfums,grapefruit blackberry,29,4,3,4,60
Xerjoff Baccarat Rouge Absolute,Xerjoff,honey bergamot mint coconut anis,22,6,27,18,27
Yves Saint Laurent Pegasus Parfum,Yves Saint Laurent,black_cherry guaiac_wood chocolate brown_sugar birch,1,26,10,32,31
Dior Acqua Di Gio Noir,Dior,orange oud blood_orange brown_sugar,14,63,7,16,0
Giorgio Armani Rehab Parfum,Giorgio Armani,raspberry coffee yuzu pear neroli bourbon_vanilla,12,7,9,23,49
Jean Paul Gaultier Oud Wood Parfum,Jean Paul Gaultier,ginger petitgrain licorice neroli anis,41,4,22,23,10
Prada Tuscan Leather Absolute,Prada,marshmallow lavender cumin grapefruit vanilla,30,10,25,34,1
Bvlgari Tuscan Leather Cologne,Bvlgari,amberwood coffee sage brown_sugar anis,7,11,43,29,10
Creed Reflection Parfum,Creed,nutmeg ambergris oakmoss pepper,3,41,51,0,5
Roja Parfums Lost Cherry Noir,Roja Parfums,amberwood sandalwood mango cedarwood blood_orange blackberry,12,58,10,4,16
Dior Man Eau Fraiche Limited Edition,Dior,mandarin_orange orange amber saffron ambergris,16,43,11,22,8
Roja Parfums Sedley Parfum,Roja Parfums,nutmeg mint vanilla green_apple,4,3,21,15,57
Mancera Good Girl Gold,Mancera,mandarin_orange lemon oakmoss cedar birch,59,27,8,5,1
Byredo Layton Extreme,Byredo,wax sour_cherry pink_pepper neroli brown_sugar,30,10,33,11,16
Bvlgari Terre Privé,Bvlgari,amberwood sandalwood cedar chocolate green_apple cloves,4,37,21,16,22
Dior Reflection Privé,Dior,marshmallow fig birch vetiver cashmeran,8,23,8,37,24
Mancera Invictus Sport,Mancera,patchouli bourbon_vanilla brown_sugar birch cloves,0,16,56,18,10
Bvlgari Versace Pour Homme,Bvlgari,cacao oakmoss mandarin coffee lime agarwood,22,39,10,21,8
Bvlgari Reflection Blanche,Bvlgari,praline sichuan_pepper apple,1,4,31,25,39
Montale Erba Pura Gold,Montale,amberwood cherry_liqueur,2,57,4,3,34
Paco Rabanne Baccarat Rouge Donna,Paco Rabanne,nutmeg yuzu mango black_pepper rosewood petitgrain,26,23,25,1,25
Creed Jubilation Parfum,Creed,cedar blood_orange patchouli cloves,54,11,21,7,7
Prada Soleil Blanc Extreme,Prada,nutmeg cedarwood ambergris,8,26,58,2,6
Maison Margiela Stronger With You Absolute,Maison Margiela,papyrus orange chocolate bergamot mint tonka_bean,32,13,23,24,8
Amouage Versace Pour Homme Extreme,Amouage,cedar coconut ambroxan green_apple,4,37,7,8,44
Parfums de Marly Ultra Male Cologne,Parfums de Marly,marshmallow pepper nutmeg blackcurrant cherry_liqueur brown_sugar birch,4,15,20,42,19
Maison Margiela Gypsy Water Noir,Maison Margiela,black_cherry ambroxan oud lime cherry_liqueur grapefruit,15,40,4,3,38
Prada Bal dAfrique Eau de Parfum,Prada,mandarin_orange guaiac_wood coffee mango coconut coriander cashmeran,25,15,14,11,35
Dolce & Gabbana Code Absolute,Dolce & Gabbana,marshmallow oakmoss patchouli oud green_apple grapefruit praline,17,32,2,31,18
Paco Rabanne Le Beau Gold,Paco Rabanne,iso_e_super lemon ambroxan guaiac_wood mandarin amber brown_sugar apple,30,25,9,23,13
Maison Margiela Alexandria II Night,Maison Margiela,lemon wax coffee lime coriander agarwood,25,15,23,36,1
Versace Hacivat Absolute,Versace,cacao ambroxan cedar yuzu coriander saffron grapefruit,26,11,18,45,0
Parfums de Marly Y Le Parfum Elixir,Parfums de Marly,wax lavender ambroxan saffron praline birch,9,19,41,28,3
Nishane Mojave Ghost Parfum,Nishane,mint ebony_wood cashmeran petitgrain,21,60,13,3,3
Byredo Oahu Noir,Byredo,cacao iso_e_super black_cherry orange chocolate yuzu sour_cherry ambergris,21,27,10,28,14
Mancera Light Blue Donna,Mancera,cacao black_cherry ambroxan guaiac_wood cedar plum,10,18,0,16,56
Yves Saint Laurent Soleil Blanc Uomo,Yves Saint Laurent,sandalwood cloves cumin,6,43,39,7,5
Gucci La Nuit de L'Homme Donna,Gucci,amberwood apricot neroli coconut ebony_wood blood_orange,34,45,4,1,16
Prada Code Elixir,Prada,ambroxan patchouli lime bergamot licorice sichuan_pepper saffron dried_fruits vanilla apple,24,13,34,12,17
Mancera Black Opium Absolute,Mancera,grapefruit coconut melon,15,8,6,1,70
Initio Parfums Oud Noir Sport,Initio Parfums,lemon apple lavender pear praline blood_orange cloves,30,4,12,43,11
Versace Aventus Limited Edition,Versace,iso_e_super pepper patchouli petitgrain pink_pepper cherry_liqueur pineapple,52,15,18,1,14
Roja Parfums Rehab Cologne,Roja Parfums,pepper mandarin petitgrain cinnamon coconut agarwood vetiver,23,38,13,7,19
Giorgio Armani Invictus Elixir,Giorgio Armani,honey vetiver fig ebony_wood peach vanilla birch,1,57,1,28,13
Lancome Interlude Parfum,Lancome,amberwood cacao lime agarwood vetiver,25,56,5,13,1
Lancome Stronger With You,Lancome,iso_e_super ambroxan bergamot bourbon_vanilla ebony_wood grapefruit,18,23,5,54,0
Paco Rabanne Scandal Absolute,Paco Rabanne,grapefruit lemon sage,25,7,61,0,7
Initio Parfums The One,Initio Parfums,amberwood cacao marshmallow orange pink_pepper neroli anis,11,12,52,24,1
Versace Oud for Greatness Sport,Versace,papyrus honey plum ebony_wood,6,30,0,33,31
Mancera La Vie Est Belle Sport,Mancera,sandalwood black_pepper fig neroli blood_orange,24,41,20,0,15
Paco Rabanne Percival Sport,Paco Rabanne,honey black_cherry coffee cedarwood birch,0,30,4,54,12
Chanel Alien Limited Edition,Chanel,amber mint vanilla coriander,6,3,65,16,10
Prada One Million Donna,Prada,marshmallow oakmoss lavender rosewood green_apple ebony_wood coriander,5,46,15,13,21
Prada Acqua Di Gio Privé,Prada,amberwood guaiac_wood yuzu tonka_bean anis,11,13,19,50,7
Hermes Mojave Ghost Noir,Hermes,sandalwood pepper chocolate black_pepper green_apple ambergris caramel,0,12,60,17,11
Lancome Black Opium Absolute,Lancome,fig chocolate wax,3,7,6,54,30
Initio Parfums Intense Cafe Donna,Initio Parfums,plum rosewood cashmeran raspberry,6,26,1,5,62
Bvlgari Spicebomb Intense,Bvlgari,honey mandarin cedarwood pear bourbon_vanilla,18,34,0,17,31
Jean Paul Gaultier Layton Gold,Jean Paul Gaultier,mandarin_orange honey lemon cedar agarwood vanilla vetiver,49,24,5,12,10
Chanel Invictus Privé,Chanel,papyrus orange yuzu cumin vetiver cashmeran,30,38,26,1,5
Chanel Tuscan Leather,Chanel,lemon iso_e_super black_cherry green_apple agarwood grapefruit,29,32,5,2,32
Montale Erba Pura,Montale,honey cashmeran birch,0,62,0,35,3
Dior Ombre Leather Parfum,Dior,neroli marshmallow,40,9,6,36,9
Dolce & Gabbana Y Le Parfum Donna,Dolce & Gabbana,patchouli mint ebony_wood pepper,8,43,38,3,8
Chanel Herod,Chanel,caramel sichuan_pepper guaiac_wood cloves,3,28,14,51,4
Gucci Accento Blanche,Gucci,mandarin_orange amber marshmallow cashmeran,12,55,0,29,4
Montale Invictus Cologne,Montale,amberwood cacao iso_e_super ambroxan wax ginger sour_cherry anis,4,21,12,22,41
Roja Parfums Tobacco Vanille Extreme,Roja Parfums,passionfruit oakmoss lime green_apple blood_orange,16,36,6,3,39
Hermes Grey Vetiver Parfum,Hermes,caramel ginger wax mandarin,21,5,18,50,6
Giorgio Armani Code Privé,Giorgio Armani,orange mango mint brown_sugar saffron,40,6,12,29,13
Giorgio Armani Angels Share Extreme,Giorgio Armani,ambergris lemon cardamom,56,13,29,1,1
Hermes Side Effect Sport,Hermes,chocolate agarwood coconut apple,6,19,6,23,46
Gucci Love Dont Be Shy Absolute,Gucci,sichuan_pepper black_cherry lime wax,18,7,39,14,22
Nishane Grey Vetiver Elixir,Nishane,mandarin_orange petitgrain sichuan_pepper tonka_bean dried_fruits,15,9,16,32,28
Xerjoff Santal 33 Cologne,Xerjoff,neroli passionfruit blood_orange rosewood,40,27,8,2,23
Maison Margiela Soleil Blanc Cologne,Maison Margiela,amberwood orange patchouli yuzu cedarwood ginger pear,55,11,11,4,19
Bvlgari Black Opium Eau de Parfum,Bvlgari,lemon raspberry mandarin cedar ebony_wood peach,36,26,10,10,18
Lancome Man Eau Fraiche Extreme,Lancome,honey raspberry nutmeg cedar sage melon tonka_bean ambergris,9,15,37,17,22
Jean Paul Gaultier Scandal,Jean Paul Gaultier,coffee black_pepper sichuan_pepper cashmeran,10,38,19,30,3
Lancome Good Girl Intense,Lancome,lavender mandarin guaiac_wood petitgrain saffron,19,45,24,10,2
Roja Parfums Love Dont Be Shy Extreme,Roja Parfums,mango blood_orange pineapple,33,9,6,0,52
Kilian Coco Mademoiselle Absolute,Kilian,coffee birch fig,1,24,9,40,26
Bvlgari Le Beau Night,Bvlgari,licorice neroli pineapple green_apple,46,3,8,24,19
Jean Paul Gaultier Libre Elixir,Jean Paul Gaultier,passionfruit,3,8,7,1,81
Paco Rabanne Reflection Donna,Paco Rabanne,cacao sandalwood guaiac_wood cedarwood sichuan_pepper cumin,8,39,30,17,6
Parfums de Marly Fucking Fabulous Sport,Parfums de Marly,passionfruit pepper mandarin ginger pineapple,21,7,55,0,17
Mancera Hypnotic Poison Night,Mancera,neroli blood_orange raspberry amber,50,5,5,28,12
Xerjoff Erba Pura Night,Xerjoff,coffee chocolate blackcurrant petitgrain neroli plum anis,20,10,18,27,25
Montale Sauvage Gold,Montale,amberwood lavender pepper chocolate ebony_wood brown_sugar,1,18,19,56,6
Versace Millessime Imperial Sport,Versace,oakmoss nutmeg sage agarwood vanilla vetiver caramel,4,17,36,37,6
Bvlgari The One Noir,Bvlgari,mandarin_orange papyrus mango licorice ambergris,19,39,1,19,22
Kilian Green Irish Tweed Donna,Kilian,bourbon_vanilla iso_e_super sichuan_pepper,2,34,27,33,4
Bvlgari No 5 Uomo,Bvlgari,guaiac_wood chocolate apricot black_pepper melon tonka_bean,5,40,15,27,13
Chanel Spicebomb Limited Edition,Chanel,grapefruit iso_e_super marshmallow cloves,11,21,39,19,10
Giorgio Armani Hacivat Extreme,Giorgio Armani,cumin ebony_wood lavender bergamot,14,34,40,7,5
Dolce & Gabbana Millessime Imperial Gold,Dolce & Gabbana,amberwood wax guaiac_wood pink_pepper,1,31,50,16,2
Roja Parfums Oud Wood Uomo,Roja Parfums,mandarin_orange blood_orange coriander caramel,18,8,14,51,9
Initio Parfums Love Dont Be Shy Blanche,Initio Parfums,cedarwood bergamot plum grapefruit cashmeran,28,50,2,6,14
Creed Herod Privé,Creed,lemon cedar licorice coconut brown_sugar grapefruit blackberry,31,11,8,32,18
Gucci Fan Your Flames Privé,Gucci,mandarin_orange black_cherry iso_e_super black_pepper coriander,26,39,13,0,22
Maison Margiela Eros Uomo,Maison Margiela,nutmeg cinnamon,4,3,88,4,1
Gucci Interlude Limited Edition,Gucci,mandarin_orange amberwood cumin plum blackberry,18,37,13,5,27
Dolce & Gabbana Straight to Heaven,Dolce & Gabbana,coffee bourbon_vanilla coriander,0,5,59,27,9
Paco Rabanne Terre Parfum,Paco Rabanne,ginger neroli saffron tonka_bean grapefruit praline,47,4,21,18,10
Versace Black Orchid Parfum,Versace,black_cherry ginger lime blackcurrant,13,10,60,3,14
Dolce & Gabbana Scandal Limited Edition,Dolce & Gabbana,yuzu agarwood brown_sugar cacao,24,33,2,36,5
Kilian Ombre Leather Donna,Kilian,mango bourbon_vanilla anis,6,7,26,40,21
Dolce & Gabbana Stronger With You Noir,Dolce & Gabbana,marshmallow ginger rosewood petitgrain neroli,28,34,18,13,7
Amouage Y Le Parfum Privé,Amouage,bourbon_vanilla praline ambroxan pineapple,6,18,0,20,56
Maison Margiela Straight to Heaven Parfum,Maison Margiela,mandarin_orange wax guaiac_wood cedarwood black_pepper petitgrain pink_pepper plum cashmeran,15,12,30,21,22
Gucci Bright Crystal Extreme,Gucci,tonka_bean bourbon_vanilla ebony_wood blackcurrant,2,20,9,29,40
Xerjoff Interlude Parfum,Xerjoff,lemon ebony_wood brown_sugar,18,16,1,57,8
Nishane Grey Vetiver Intense,Nishane,amberwood lemon sandalwood pepper ginger rosewood cherry_liqueur,19,37,14,1,29
Giorgio Armani Libre Gold,Giorgio Armani,chocolate amber lemon apricot,41,6,1,21,31
Gucci Cedrat Boise Limited Edition,Gucci,yuzu agarwood lemon iso_e_super,67,18,3,8,4
Nishane Gypsy Water Blanche,Nishane,amberwood lemon ambroxan patchouli saffron blackberry,25,39,22,1,13
Creed Lost Cherry Blanche,Creed,cedar rosewood anis mint grapefruit blood_orange caramel,19,43,11,25,2
Giorgio Armani Red Tobacco Sport,Giorgio Armani,mandarin_orange marshmallow lavender pepper mandarin dried_fruits pear praline,18,3,14,49,16
Xerjoff Erba Pura Absolute,Xerjoff,marshmallow lemon lavender mango cedarwood black_pepper licorice ebony_wood grapefruit,23,18,19,29,11
Prada Sedley Parfum,Prada,mandarin_orange marshmallow pepper coffee pink_pepper grapefruit,42,4,38,16,0
Dior Oud for Greatness Cologne,Dior,sandalwood pepper mandarin brown_sugar cumin blood_orange,12,16,31,40,1
Amouage La Nuit de L'Homme Night,Amouage,peach cardamom blood_orange,27,10,44,2,17
Gucci Layton Privé,Gucci,mandarin_orange marshmallow apricot amber neroli plum vetiver,22,11,0,27,40
Byredo Bright Crystal Limited Edition,Byredo,amberwood lavender oud ginger blackcurrant praline,3,11,16,37,33
Tom Ford Santal 33 Blanche,Tom Ford,amberwood guaiac_wood cedar lime bergamot licorice,24,39,10,23,4
Montale Spicebomb Absolute,Montale,oud lime raspberry mandarin,38,22,6,8,26
Bvlgari La Vie Est Belle Absolute,Bvlgari,rosewood pear sage tonka_bean praline,3,20,44,11,22
Giorgio Armani Le Beau Absolute,Giorgio Armani,guaiac_wood neroli ebony_wood plum pineapple,11,57,0,3,29
Xerjoff Dylan Blue Cologne,Xerjoff,lemon wax pepper mango bergamot brown_sugar,37,6,19,26,12
Nishane Soleil Blanc,Nishane,cacao sandalwood mango ginger cardamom brown_sugar blackberry,3,28,24,17,28
Lancome Roses Vanille Parfum,Lancome,oud blood_orange,11,68,10,4,7
Mancera Fucking Fabulous Parfum,Mancera,cacao passionfruit ginger cherry_liqueur coriander,6,9,30,43,12
Maison Margiela Layton Uomo,Maison Margiela,honey amber cardamom mint pineapple,0,9,49,14,28
Gucci Le Male Uomo,Gucci,mandarin_orange lemon wax bourbon_vanilla coconut,19,2,5,55,19
Byredo Eros Limited Edition,Byredo,lime lavender petitgrain,23,5,66,6,0
Prada Millessime Imperial Intense,Prada,mandarin_orange oakmoss guaiac_wood mandarin cedar amber licorice,14,17,0,65,4
Montale Red Tobacco Eau de Parfum,Montale,papyrus pepper vetiver cumin,2,27,70,0,1
Paco Rabanne Alien Limited Edition,Paco Rabanne,mandarin_orange honey orange cedar mango pear,17,43,1,14,25
Roja Parfums Jubilation Noir,Roja Parfums,pink_pepper melon,5,5,78,0,12
Byredo La Vie Est Belle Cologne,Byredo,nutmeg yuzu blackcurrant bourbon_vanilla saffron,14,10,18,14,44
Kilian Herod Night,Kilian,lime blackcurrant licorice vanilla cashmeran,22,24,3,30,21
Bvlgari Tygar Uomo,Bvlgari,saffron coconut black_pepper,2,9,14,10,65
Hermes Dylan Blue Privé,Hermes,black_cherry blackcurrant petitgrain neroli praline,18,10,2,50,20
Mancera Kobraa Uomo,Mancera,iso_e_super sandalwood sour_cherry bergamot cloves,22,22,28,5,23
Kilian Spicebomb Privé,Kilian,honey ambroxan coffee patchouli lime rosewood petitgrain coconut apple,16,38,9,13,24
Hermes Naxos Intense,Hermes,coffee yuzu cardamom bergamot licorice cumin,47,10,11,27,5
Creed Cedrat Boise,Creed,honey lavender yuzu mint brown_sugar,15,4,62,13,6
Paco Rabanne Noir Extreme Night,Paco Rabanne,mandarin_orange cacao nutmeg cinnamon ebony_wood vanilla,37,13,14,29,7
Jean Paul Gaultier Oahu,Jean Paul Gaultier,amberwood cacao iso_e_super black_pepper licorice saffron grapefruit vetiver,24,15,14,38,9
Initio Parfums Tygar Blanche,Initio Parfums,nutmeg marshmallow iso_e_super pepper,7,34,22,28,9
Parfums de Marly Ombre Leather Absolute,Parfums de Marly,amberwood cacao iso_e_super bergamot coconut plum saffron grapefruit,14,21,17,22,26
Amouage Intense Cafe Uomo,Amouage,nutmeg patchouli cedar sage tonka_bean blood_orange,23,38,14,15,10
Giorgio Armani Hacivat Limited Edition,Giorgio Armani,marshmallow lavender lime licorice saffron cashmeran,12,16,31,32,9
Yves Saint Laurent La Nuit de L'Homme Donna,Yves Saint Laurent,tonka_bean passionfruit birch caramel,6,52,6,21,15
Dolce & Gabbana Crystal Noir Eau de Parfum,Dolce & Gabbana,coffee lime caramel,38,8,0,54,0
Versace Le Beau Limited Edition,Versace,papyrus oakmoss orange nutmeg melon vetiver,39,28,11,6,16
Kilian Interlude Blanche,Kilian,orange grapefruit coriander sour_cherry,26,9,25,10,30
Versace Fucking Fabulous Elixir,Versace,cacao caramel,6,9,8,69,8
Mancera Kobraa Night,Mancera,neroli amber,18,9,6,61,6
Dolce & Gabbana Oud for Greatness Absolute,Dolce & Gabbana,licorice yuzu coconut,17,10,3,31,39
Hermes Intense Cafe Gold,Hermes,vanilla coconut oakmoss birch,10,25,2,26,37
Xerjoff Oajan Sport,Xerjoff,honey black_cherry orange bergamot bourbon_vanilla,47,5,7,22,19
Nishane No 5 Uomo,Nishane,orange chocolate anis pineapple,29,5,17,30,19
Montale Eros Sport,Montale,oakmoss sour_cherry neroli sichuan_pepper praline blood_orange,23,19,12,20,26
Giorgio Armani Coco Mademoiselle Privé,Giorgio Armani,grapefruit marshmallow coriander bergamot,31,3,36,29,1
Montale Oahu Uomo,Montale,mandarin_orange cloves bergamot,56,2,30,9,3
Lancome Lost Cherry Intense,Lancome,honey oakmoss cedar yuzu amber fig peach,11,29,7,40,13
Paco Rabanne Santal 33 Blanche,Paco Rabanne,orange chocolate bourbon_vanilla apple,17,2,8,39,34
Yves Saint Laurent Scandal Extreme,Yves Saint Laurent,orange mandarin_orange marshmallow melon,40,5,5,11,39
Versace One Million Noir,Versace,oakmoss patchouli cardamom brown_sugar birch apple,5,21,26,37,11
Nishane Alexandria II Donna,Nishane,black_cherry guaiac_wood cardamom black_pepper melon cashmeran,0,36,42,1,21
Montale Black Opium Elixir,Montale,papyrus oud pink_pepper neroli grapefruit,58,23,11,6,2
Kilian The One Intense,Kilian,marshmallow iso_e_super blood_orange sour_cherry,22,26,6,18,28
Dior Alexandria II Extreme,Dior,iso_e_super sichuan_pepper melon cumin dried_fruits blood_orange,13,30,13,5,39
Hermes Cedrat Boise Privé,Hermes,ambroxan cedar amber lime petitgrain birch,48,22,6,20,4
Yves Saint Laurent Ultra Male Night,Yves Saint Laurent,papyrus cacao marshmallow sage cashmeran,7,13,55,18,7
Maison Margiela Acqua Di Gio Intense,Maison Margiela,ambergris ambroxan,4,78,5,3,10
Creed Carlisle,Creed,papyrus honey orange amber ginger rosewood coriander,23,12,37,23,5
Mancera Ultra Male Night,Mancera,mandarin_orange honey cinnamon neroli agarwood,14,48,21,12,5
Parfums de Marly Accento Elixir,Parfums de Marly,cacao pepper lime cinnamon bourbon_vanilla vetiver,14,24,31,30,1
Mancera Sauvage Parfum,Mancera,papyrus oakmoss cedarwood amber mint,4,20,34,36,6
Byredo Coco Mademoiselle Donna,Byredo,grapefruit sandalwood,60,29,3,1,7
Amouage Angels Share Elixir,Amouage,guaiac_wood blackcurrant black_pepper saffron dried_fruits,9,33,23,3,32
Dior Angels Share Absolute,Dior,marshmallow oakmoss wax orange pear cinnamon peach vetiver,14,24,22,20,20
Amouage Coco Mademoiselle Night,Amouage,passionfruit guaiac_wood lavender rosewood bergamot neroli peach anis,15,16,19,8,42
Chanel Oud Wood Night,Chanel,green_apple sage bergamot coconut blood_orange,33,3,18,10,36
Byredo Oud Noir Noir,Byredo,papyrus cedar chocolate neroli melon grapefruit,11,38,4,20,27
Lancome Erba Pura Privé,Lancome,nutmeg agarwood wax vetiver,7,29,15,43,6
Yves Saint Laurent Jubilation Noir,Yves Saint Laurent,ambroxan pepper bergamot neroli vetiver,27,16,49,6,2
Amouage By the Fireplace Uomo,Amouage,passionfruit oakmoss lavender nutmeg cedarwood lime,32,13,34,1,20
Dolce & Gabbana Eros Limited Edition,Dolce & Gabbana,iso_e_super guaiac_wood coffee apricot sour_cherry ambergris blood_orange caramel,19,12,2,19,48
Versace Naxos,Versace,oakmoss guaiac_wood patchouli apricot cardamom bergamot,13,29,35,10,13
Prada Ombre Leather Cologne,Prada,amberwood tonka_bean sandalwood mandarin,39,27,7,17,10
Dior Jadore Gold,Dior,pear tonka_bean chocolate cloves,0,9,16,41,34
Prada Cedrat Boise Intense,Prada,iso_e_super sandalwood peach anis vetiver,10,26,22,7,35
Bvlgari Gypsy Water Gold,Bvlgari,wax coffee black_pepper sichuan_pepper grapefruit blood_orange,22,10,25,38,5
Maison Margiela Bal dAfrique Blanche,Maison Margiela,amberwood pineapple petitgrain licorice fig vanilla cashmeran,15,24,1,19,41
Yves Saint Laurent Red Tobacco,Yves Saint Laurent,passionfruit wax fig neroli cumin tonka_bean,17,7,21,44,11
Roja Parfums Gyan Intense,Roja Parfums,iso_e_super pear licorice cinnamon sour_cherry vanilla cloves,6,13,21,13,47
Nishane Alien Elixir,Nishane,papyrus cedarwood yuzu rosewood bourbon_vanilla grapefruit praline,23,27,4,36,10
Giorgio Armani Baccarat Rouge Cologne,Giorgio Armani,coconut ginger wax sage,1,6,65,16,12
Amouage La Vie Est Belle Blanche,Amouage,mandarin,70,8,9,3,10
Montale Tuscan Leather Elixir,Montale,green_apple neroli black_cherry cacao,11,5,8,55,21
Creed Percival Donna,Creed,papyrus cacao cardamom pink_pepper,2,50,24,18,6
