name,brand,notes,citrus,woody,fresh_spicy,sweet,fruity
Giorgio Armani Ani Elixir,Giorgio Armani,papyrus ambroxan cedar cardamom black_pepper licorice,10,12,21,51,6
Jean Paul Gaultier Kobraa Blanche,Jean Paul Gaultier,mandarin yuzu mint saffron blackberry,21,6,38,1,34
Creed Erba Pura Extreme,Creed,mandarin_orange mandarin mango licorice cumin vanilla,11,7,41,25,16
Amouage Eros Privé,Amouage,cacao cedar chocolate dried_fruits apple,9,26,10,36,19
Jean Paul Gaultier Intense Cafe Night,Jean Paul Gaultier,cinnamon yuzu mandarin,54,7,23,10,6
Prada Galloway Extreme,Prada,yuzu cherry_liqueur anis lavender,38,10,27,2,23
Tom Ford Invictus,Tom Ford,ambroxan nutmeg patchouli apricot mango ambergris vanilla,5,19,13,18,45
Parfums de Marly Bal dAfrique Gold,Parfums de Marly,cacao birch,9,39,9,40,3
Mancera La Nuit de L'Homme Absolute,Mancera,marshmallow yuzu amber petitgrain peach plum saffron,20,6,26,26,22
Dior Ani Intense,Dior,cacao lemon plum saffron grapefruit,14,5,27,13,41
Tom Ford Green Irish Tweed Cologne,Tom Ford,black_cherry lemon oakmoss mango lime ambergris,22,59,3,4,12
Bvlgari Gyan Donna,Bvlgari,amberwood wax cedar lime fig dried_fruits,25,18,3,20,34
Creed Scandal Privé,Creed,guaiac_wood cedarwood petitgrain pear cumin agarwood anis,24,11,26,5,34
Lancome Versace Pour Homme Cologne,Lancome,passionfruit mandarin chocolate lime brown_sugar vetiver,29,20,9,13,29
Gucci Jubilation Night,Gucci,cacao sandalwood cedar coriander vanilla blood_orange cloves,14,20,19,44,3
Creed Red Tobacco,Creed,amberwood lemon black_cherry mandarin licorice ambergris apple,33,12,7,29,19
Kilian Light Blue Night,Kilian,cacao iso_e_super coffee saffron grapefruit blood_orange,33,29,16,13,9
Nishane Interlude Privé,Nishane,honey lemon apple,45,7,9,25,14
Gucci L'Homme Cologne,Gucci,mint lemon lavender bergamot,24,8,59,6,3
Montale Bright Crystal Intense,Montale,peach iso_e_super birch mandarin,28,50,1,0,21
Lancome Pegasus Parfum,Lancome,papyrus nutmeg oakmoss sour_cherry,5,25,49,8,13
Roja Parfums Lost Cherry Privé,Roja Parfums,melon sichuan_pepper coriander petitgrain,35,6,20,7,32
Giorgio Armani Acqua Di Gio Night,Giorgio Armani,lavender ginger lime rosewood,37,12,39,5,7
Mancera Scandal Intense,Mancera,cacao nutmeg patchouli petitgrain tonka_bean blood_orange cashmeran,47,17,11,18,7
Nishane Neroli Portofino Uomo,Nishane,pink_pepper ginger wax,3,10,71,14,2
Jean Paul Gaultier L'Homme Extreme,Jean Paul Gaultier,papyrus grapefruit oakmoss,56,35,0,7,2
Nishane Spicebomb,Nishane,amberwood patchouli mango pear cashmeran,10,29,1,3,57
Initio Parfums Santal 33 Blanche,Initio Parfums,lemon wax yuzu rosewood blackcurrant melon,21,24,0,13,42
Yves Saint Laurent Fan Your Flames Absolute,Yves Saint Laurent,cacao passionfruit mango yuzu cardamom sichuan_pepper grapefruit,20,2,33,20,25
Paco Rabanne Naxos Intense,Paco Rabanne,papyrus chocolate coconut vetiver,5,17,6,60,12
Dior Kobraa Parfum,Dior,dried_fruits anis blackberry,1,2,64,3,30
Dior Oajan,Dior,cacao oakmoss plum saffron anis,7,12,23,25,33
Bvlgari Jubilation Eau de Parfum,Bvlgari,lemon cedar bergamot coconut praline,20,19,4,29,28
Prada The One Noir,Prada,orange mango cedarwood neroli ebony_wood plum praline birch caramel,39,25,3,21,12
Maison Margiela Herod Cologne,Maison Margiela,fig mango bourbon_vanilla lemon,31,9,2,12,46
Maison Margiela The One,Maison Margiela,amberwood orange cedarwood cinnamon neroli cloves,12,59,18,7,4
Maison Margiela Naxos Sport,Maison Margiela,iso_e_super cedar pink_pepper bourbon_vanilla cumin ambergris,0,31,40,26,3
Hermes Terre Absolute,Hermes,marshmallow lemon guaiac_wood green_apple fig ebony_wood brown_sugar birch,31,34,5,16,14
Kilian Soleil Blanc Donna,Kilian,pink_pepper chocolate licorice lavender,7,8,53,27,5
Montale Tygar Blanche,Montale,papyrus lavender lime mint dried_fruits blackberry,24,19,26,7,24
Paco Rabanne Pegasus Absolute,Paco Rabanne,honey cinnamon bourbon_vanilla cloves,8,4,54,31,3
Gucci Naxos Elixir,Gucci,amberwood cedarwood cardamom blackcurrant petitgrain neroli vetiver apple,19,26,11,6,38
Roja Parfums Man Eau Fraiche Noir,Roja Parfums,mandarin_orange oakmoss guaiac_wood cardamom neroli sichuan_pepper brown_sugar agarwood caramel,33,31,18,15,3
Dolce & Gabbana One Million,Dolce & Gabbana,nutmeg amber coconut praline blackberry,1,5,54,17,23
Jean Paul Gaultier Aventus Gold,Jean Paul Gaultier,orange wax brown_sugar,29,10,9,42,10
Paco Rabanne Jadore Gold,Paco Rabanne,papyrus lime bourbon_vanilla tonka_bean ambergris vetiver,40,40,9,11,0
Versace Bal dAfrique,Versace,apricot melon guaiac_wood,5,52,2,7,34
Parfums de Marly Le Beau Sport,Parfums de Marly,iso_e_super mandarin patchouli amber apricot sour_cherry blood_orange birch,15,48,7,17,13
Tom Ford Black Opium Sport,Tom Ford,apple patchouli cedarwood lime blood_orange cloves,38,15,19,6,22
Amouage Green Irish Tweed Eau de Parfum,Amouage,guaiac_wood coffee chocolate blackcurrant neroli plum,15,19,1,18,47
Lancome Rehab Extreme,Lancome,nutmeg patchouli sandalwood licorice,3,30,19,44,4
Creed Sedley,Creed,sandalwood lavender cedar rosewood bergamot bourbon_vanilla,40,11,26,22,1
Parfums de Marly Tobacco Vanille Absolute,Parfums de Marly,coffee blackcurrant sage licorice cumin blackberry,2,3,18,17,60
Roja Parfums Oahu Noir,Roja Parfums,ebony_wood cashmeran petitgrain,25,54,10,4,7
Initio Parfums Aventus Intense,Initio Parfums,cacao praline black_pepper petitgrain,28,10,29,28,5
Chanel Millessime Imperial Parfum,Chanel,cedarwood bergamot cinnamon blood_orange vetiver,53,23,13,5,6
Dolce & Gabbana Acqua Di Gio Sport,Dolce & Gabbana,coffee bergamot tonka_bean ambergris grapefruit apple,19,36,10,18,17
Gucci Good Girl Blanche,Gucci,amberwood nutmeg licorice cumin cashmeran,8,21,11,58,2
Mancera Alien Uomo,Mancera,oakmoss cedar black_pepper pear cinnamon melon,2,20,49,3,26
Nishane Layton Privé,Nishane,licorice cinnamon mango cherry_liqueur,10,8,22,28,32
Jean Paul Gaultier Scandal Gold,Jean Paul Gaultier,lemon raspberry apricot ginger coriander agarwood grapefruit,17,18,22,8,35
Nishane Ani Donna,Nishane,mandarin_orange saffron blood_orange,24,6,70,0,0
Xerjoff Rehab Privé,Xerjoff,neroli vanilla bergamot,39,3,9,47,2
Nishane Galloway Uomo,Nishane,papyrus patchouli chocolate cinnamon neroli agarwood,18,11,55,14,2
Paco Rabanne Alexandria II Cologne,Paco Rabanne,oakmoss dried_fruits amber lime praline blood_orange,35,17,8,25,15
Versace Percival Sport,Versace,guaiac_wood grapefruit vetiver rosewood,33,52,2,3,10
Xerjoff Sauvage Extreme,Xerjoff,plum lavender cashmeran sour_cherry,9,48,24,0,19
Dolce & Gabbana Tuscan Leather Extreme,Dolce & Gabbana,amberwood yuzu rosewood cashmeran cloves,17,16,57,3,7
Parfums de Marly Tobacco Vanille Night,Parfums de Marly,iso_e_super coffee cedarwood rosewood brown_sugar,5,70,0,16,9
Paco Rabanne Oud Noir Donna,Paco Rabanne,pink_pepper apricot caramel sage,5,10,23,49,13
Amouage L'Homme Noir,Amouage,yuzu blackcurrant grapefruit dried_fruits caramel,57,8,10,11,14
Nishane Sauvage Night,Nishane,guaiac_wood coffee sage petitgrain bourbon_vanilla saffron vetiver,12,45,15,21,7
Dolce & Gabbana Gyan Extreme,Dolce & Gabbana,marshmallow oakmoss raspberry coconut agarwood,8,37,0,38,17
Gucci Oud Wood Eau de Parfum,Gucci,cacao black_cherry chocolate cardamom ginger rosewood petitgrain blood_orange vetiver,22,14,15,22,27
Paco Rabanne Le Beau Extreme,Paco Rabanne,coriander coffee vetiver cloves,2,57,15,17,9
Paco Rabanne La Vie Est Belle Limited Edition,Paco Rabanne,pink_pepper grapefruit lemon,44,10,38,6,2
Creed Straight to Heaven Gold,Creed,brown_sugar birch petitgrain,24,28,2,45,1
Mancera Tobacco Vanille Extreme,Mancera,coffee oakmoss,8,59,3,28,2
Lancome Crystal Noir Blanche,Lancome,nutmeg,10,2,83,5,0
Yves Saint Laurent Soleil Blanc Sport,Yves Saint Laurent,cinnamon neroli blackberry apple,17,4,48,4,27
Dior Crystal Noir Uomo,Dior,lemon ginger melon brown_sugar grapefruit vetiver,14,26,28,17,15
Gucci Hacivat Gold,Gucci,nutmeg yuzu apricot ginger blackberry ebony_wood cashmeran,16,20,42,10,12
Jean Paul Gaultier Silver Mountain Water Sport,Jean Paul Gaultier,lavender orange patchouli cardamom petitgrain,64,15,17,3,1
Paco Rabanne The One Donna,Paco Rabanne,lime oakmoss bergamot,16,75,0,5,4
Prada Tuscan Leather Limited Edition,Prada,ambroxan lavender cedar cardamom plum grapefruit blood_orange,20,13,48,7,12
Initio Parfums Bright Crystal Night,Initio Parfums,orange nutmeg marshmallow coffee,37,3,38,13,9
Giorgio Armani Tygar Blanche,Giorgio Armani,cinnamon melon brown_sugar dried_fruits anis,10,7,20,23,40
Lancome Man Eau Fraiche Uomo,Lancome,patchouli brown_sugar,5,30,8,48,9
Versace Green Irish Tweed Night,Versace,coffee bergamot licorice grapefruit dried_fruits,19,10,5,16,50
Montale Pegasus Limited Edition,Montale,oud fig brown_sugar peach birch,7,34,8,40,11
Nishane Grey Vetiver Uomo,Nishane,orange patchouli cinnamon black_pepper,15,27,54,4,0
Versace Tuscan Leather Privé,Versace,pink_pepper dried_fruits melon rosewood,6,42,19,0,33
Dolce & Gabbana Tuscan Leather Sport,Dolce & Gabbana,fig passionfruit,6,9,7,1,77
Mancera Side Effect Blanche,Mancera,marshmallow lemon fig cinnamon neroli bourbon_vanilla birch,17,23,38,11,11
Jean Paul Gaultier Acqua Di Gio Eau de Parfum,Jean Paul Gaultier,amberwood praline,10,60,5,16,9
Maison Margiela Hypnotic Poison Blanche,Maison Margiela,passionfruit pepper anis bergamot grapefruit vanilla,15,6,17,21,41
Paco Rabanne Kobraa Sport,Paco Rabanne,apple bergamot,53,5,1,10,31
Byredo Oud Noir Intense,Byredo,honey green_apple melon agarwood grapefruit birch caramel,17,12,5,50,16
Dolce & Gabbana Tuscan Leather Cologne,Dolce & Gabbana,fig praline dried_fruits,2,8,7,66,17
Nishane Rehab Night,Nishane,mandarin_orange amberwood nutmeg mango bergamot fig cashmeran,29,23,36,1,11
Paco Rabanne Herod Blanche,Paco Rabanne,lemon wax orange cedar cinnamon mint,13,21,38,22,6
Bvlgari Black Phantom Cologne,Bvlgari,orange vanilla blood_orange cherry_liqueur,12,8,3,37,40
Versace Baccarat Rouge Blanche,Versace,amber petitgrain peach vanilla birch cloves,18,16,29,18,19
Lancome Straight to Heaven Sport,Lancome,oakmoss pepper patchouli chocolate sage ambergris,10,21,29,36,4
Mancera Good Girl Blanche,Mancera,chocolate cherry_liqueur ambroxan rosewood,2,13,1,17,67
Giorgio Armani The One Sport,Giorgio Armani,mandarin_orange bourbon_vanilla ginger cumin,37,7,29,22,5
Yves Saint Laurent Dylan Blue Uomo,Yves Saint Laurent,marshmallow oakmoss guaiac_wood oud neroli,35,30,3,29,3
Creed Accento,Creed,mandarin_orange papyrus honey cedar ginger neroli mint agarwood,28,33,25,12,2
Dolce & Gabbana Side Effect Privé,Dolce & Gabbana,honey cacao passionfruit cardamom ebony_wood blood_orange cumin vetiver cashmeran,17,15,32,16,20
Yves Saint Laurent Acqua Di Gio Extreme,Yves Saint Laurent,papyrus coriander ambergris cashmeran,7,23,58,5,7
Montale Acqua Di Gio Eau de Parfum,Montale,ambroxan amber neroli saffron blood_orange,30,17,13,36,4
Maison Margiela Baccarat Rouge Eau de Parfum,Maison Margiela,papyrus guaiac_wood ginger blackcurrant pink_pepper ambergris,1,52,11,1,35
Yves Saint Laurent Versace Pour Homme Uomo,Yves Saint Laurent,sandalwood oud mint peach ambergris apple,10,15,33,6,36
Montale Crystal Noir,Montale,passionfruit lemon sandalwood guaiac_wood orange cardamom sage green_apple vetiver,29,20,17,5,29
Dolce & Gabbana Black Opium Donna,Dolce & Gabbana,fig nutmeg mandarin,26,7,24,6,37
Creed Ombre Leather Eau de Parfum,Creed,black_cherry lavender yuzu bourbon_vanilla brown_sugar anis blackberry,25,3,38,11,23
Dolce & Gabbana Black Orchid Cologne,Dolce & Gabbana,agarwood lemon brown_sugar,31,43,1,23,2
Paco Rabanne The One,Paco Rabanne,papyrus mandarin patchouli birch caramel,50,32,0,17,1
Amouage Interlude Noir,Amouage,papyrus agarwood cashmeran fig,4,23,5,4,64
Mancera Erba Pura Elixir,Mancera,apple pineapple brown_sugar,7,5,2,13,73
Parfums de Marly Crystal Noir Privé,Parfums de Marly,cacao cedarwood black_pepper petitgrain saffron praline,24,21,33,22,0
Bvlgari Red Tobacco Gold,Bvlgari,lavender mandarin patchouli lime blackcurrant peach tonka_bean praline,11,33,15,16,25
Prada Oud Noir Limited Edition,Prada,lemon oakmoss orange apricot cedarwood black_pepper coriander,30,29,28,2,11
Roja Parfums Kobraa Privé,Roja Parfums,lemon oakmoss lavender coffee black_pepper bergamot birch,17,38,26,14,5
Bvlgari Oahu Night,Bvlgari,marshmallow blackcurrant petitgrain plum blood_orange,29,9,6,11,45
Amouage Oajan Donna,Amouage,mandarin_orange patchouli yuzu nutmeg sour_cherry coriander,40,29,13,1,17
Giorgio Armani Spicebomb Absolute,Giorgio Armani,guaiac_wood patchouli amber licorice neroli,27,20,7,39,7
Versace Hypnotic Poison Limited Edition,Versace,pear cardamom blackcurrant brown_sugar,0,9,23,36,32
Dolce & Gabbana Good Girl Gold,Dolce & Gabbana,wax ambroxan pepper apricot cedarwood ginger,0,27,21,28,24
Dior Reflection Sport,Dior,passionfruit rosewood melon coriander agarwood,4,14,53,4,25
Paco Rabanne Baccarat Rouge Blanche,Paco Rabanne,orange cumin pepper bergamot,53,10,37,0,0
Versace Gypsy Water Uomo,Versace,ambroxan patchouli cinnamon peach vetiver pineapple,10,28,23,1,38
Yves Saint Laurent Black Orchid Blanche,Yves Saint Laurent,yuzu praline lavender cloves,25,7,48,14,6
Prada Roses Vanille Blanche,Prada,orange sage,73,4,14,3,6
Mancera One Million Absolute,Mancera,sour_cherry cacao blackberry mandarin,12,4,3,36,45
Chanel Light Blue Donna,Chanel,papyrus oakmoss lavender raspberry blackcurrant vetiver,7,32,23,9,29
Roja Parfums Hypnotic Poison Donna,Roja Parfums,coffee patchouli rosewood petitgrain pink_pepper bergamot dried_fruits,21,17,14,18,30
Parfums de Marly Grey Vetiver Night,Parfums de Marly,iso_e_super mandarin ebony_wood grapefruit cashmeran cloves,28,34,27,9,2
Creed Alien Gold,Creed,orange bergamot cinnamon ebony_wood ambergris anis birch,40,15,38,4,3
Kilian Jubilation Blanche,Kilian,sage bourbon_vanilla tonka_bean grapefruit blood_orange,14,9,49,27,1
Gucci Rehab Absolute,Gucci,apple pepper chocolate cedarwood pineapple lime pink_pepper birch caramel,15,28,26,13,18
Gucci By the Fireplace Privé,Gucci,black_cherry raspberry cardamom lime licorice brown_sugar grapefruit,18,6,23,12,41
Initio Parfums The One Absolute,Initio Parfums,orange patchouli cedar cedarwood neroli,27,49,10,10,4
Nishane Invictus Night,Nishane,guaiac_wood cedarwood sichuan_pepper saffron vanilla,10,16,22,49,3
Lancome Green Irish Tweed Sport,Lancome,amberwood cacao oakmoss mandarin coffee bergamot saffron anis,24,23,13,36,4
Yves Saint Laurent Side Effect Extreme,Yves Saint Laurent,raspberry cedarwood fig bourbon_vanilla grapefruit birch,18,51,0,16,15
Kilian Coco Mademoiselle Elixir,Kilian,papyrus wax amber lime anis,14,38,31,12,5
Byredo Fucking Fabulous Gold,Byredo,apricot ginger lavender,2,3,29,0,66
Nishane La Nuit de L'Homme,Nishane,lemon sandalwood wax yuzu bourbon_vanilla ambergris,29,53,5,11,2
Gucci Invictus Absolute,Gucci,cacao rosewood fig bourbon_vanilla mint,6,12,15,46,21
Tom Ford Oud Wood Cologne,Tom Ford,black_cherry lavender,10,5,26,7,52
Montale Cedrat Boise Elixir,Montale,lime cherry_liqueur caramel,36,6,10,36,12
Maison Margiela Bal dAfrique Noir,Maison Margiela,passionfruit guaiac_wood amber cardamom sage,8,11,31,27,23
Lancome Silver Mountain Water Sport,Lancome,mandarin orange nutmeg chocolate bourbon_vanilla cumin,11,8,16,57,8
Initio Parfums Good Girl Elixir,Initio Parfums,yuzu,75,5,8,4,8
Parfums de Marly Baccarat Rouge Noir,Parfums de Marly,saffron honey neroli yuzu,15,10,22,46,7
Gucci Oahu Privé,Gucci,lemon wax cedarwood oud cardamom pink_pepper praline,43,34,11,12,0
Mancera Carlisle,Mancera,honey iso_e_super oakmoss mandarin ginger ebony_wood coriander caramel,15,13,29,33,10
Gucci Ani Intense,Gucci,apricot lemon melon bergamot,70,4,1,1,24
Byredo Angels Share Gold,Byredo,papyrus amberwood cacao pepper cedarwood petitgrain sour_cherry cherry_liqueur cumin grapefruit praline,19,13,25,30,13
Paco Rabanne La Vie Est Belle Uomo,Paco Rabanne,pear chocolate grapefruit bergamot,32,3,4,29,32
Xerjoff Libre Donna,Xerjoff,licorice amber grapefruit ebony_wood,24,45,1,28,2
Byredo Santal 33 Privé,Byredo,lemon coriander cumin,14,8,63,5,10
Amouage Code Parfum,Amouage,mandarin_orange amberwood black_pepper rosewood melon brown_sugar blood_orange blackberry,19,15,30,12,24
Amouage Lost Cherry Sport,Amouage,sage ambergris oakmoss cumin,4,35,51,1,9
Dior Herod Uomo,Dior,honey cherry_liqueur guaiac_wood mandarin,16,20,7,23,34
Jean Paul Gaultier Sedley Cologne,Jean Paul Gaultier,sour_cherry tonka_bean cashmeran petitgrain,18,41,0,28,13
Chanel Soleil Blanc Uomo,Chanel,iso_e_super oakmoss ambroxan tonka_bean apple,5,29,0,40,26
Xerjoff Layton Elixir,Xerjoff,neroli sandalwood praline guaiac_wood,19,13,4,56,8
Creed Le Beau Absolute,Creed,patchouli,9,85,0,3,3
Byredo Kobraa Parfum,Byredo,wax pepper blood_orange black_pepper,43,8,13,28,8
Yves Saint Laurent Side Effect Noir,Yves Saint Laurent,amberwood wax guaiac_wood pineapple cardamom bourbon_vanilla birch,6,11,20,52,11
Xerjoff Stronger With You Gold,Xerjoff,iso_e_super oud lime licorice cherry_liqueur,12,30,9,36,13
Tom Ford No 5 Cologne,Tom Ford,cedarwood neroli blood_orange cacao,14,66,8,12,0
Xerjoff Love Dont Be Shy Eau de Parfum,Xerjoff,mandarin_orange papyrus cacao amber sichuan_pepper vetiver cloves,54,15,11,20,0
Maison Margiela Code Extreme,Maison Margiela,iso_e_super black_cherry lavender blackcurrant coriander grapefruit birch cashmeran,19,22,33,6,20
Lancome Tygar Uomo,Lancome,saffron cherry_liqueur,2,5,23,9,61
Creed Fucking Fabulous Uomo,Creed,apricot praline mango,6,2,0,20,72
Chanel Love Dont Be Shy Blanche,Chanel,mandarin_orange cacao petitgrain anis cashmeran cloves,19,23,12,42,4
Tom Ford Stronger With You Eau de Parfum,Tom Ford,honey ambroxan oakmoss cedarwood licorice fig,3,43,0,32,22
Amouage Gypsy Water Cologne,Amouage,cardamom lime fig pineapple cloves,16,10,52,10,12
Prada Hacivat Noir,Prada,yuzu praline bourbon_vanilla mandarin,16,8,1,75,0
Montale Crystal Noir Donna,Montale,iso_e_super mango yuzu cardamom melon agarwood vetiver,21,22,23,0,34
Lancome Erba Pura Eau de Parfum,Lancome,amber sandalwood blackcurrant apple,9,11,6,21,53
Lancome Intense Cafe Elixir,Lancome,honey sandalwood oakmoss anis,4,16,44,32,4
Parfums de Marly Dylan Blue Uomo,Parfums de Marly,lemon apricot pear praline caramel,32,10,7,18,33
Chanel Soleil Blanc Eau de Parfum,Chanel,marshmallow cedar ginger black_pepper vanilla,8,23,48,12,9
Montale Le Beau Gold,Montale,honey nutmeg cardamom wax,7,3,44,42,4
Amouage Dylan Blue Limited Edition,Amouage,honey chocolate yuzu neroli cloves,25,4,45,16,10
Bvlgari Angels Share Limited Edition,Bvlgari,wax lime blackcurrant sage bergamot bourbon_vanilla sichuan_pepper,17,7,45,12,19
Kilian Ani Donna,Kilian,wax guaiac_wood coffee rosewood neroli,40,25,6,23,6
Dolce & Gabbana Galloway Absolute,Dolce & Gabbana,sandalwood lavender cedar rosewood petitgrain melon grapefruit pineapple,46,19,13,2,20
Paco Rabanne Santal 33 Gold,Paco Rabanne,apricot coconut,4,10,6,7,73
Versace Millessime Imperial Extreme,Versace,plum cedarwood bergamot,57,15,9,6,13
Xerjoff Rehab Uomo,Xerjoff,blood_orange black_pepper sour_cherry,34,10,23,6,27
Giorgio Armani Noir Extreme Uomo,Giorgio Armani,bourbon_vanilla blackberry cacao,10,7,0,16,67
Gucci L'Homme Sport,Gucci,oud anis guaiac_wood,1,41,45,5,8
Creed Green Irish Tweed Parfum,Creed,coffee yuzu ebony_wood birch,55,17,7,14,7
Giorgio Armani Light Blue Elixir,Giorgio Armani,marshmallow iso_e_super wax yuzu rosewood petitgrain cumin anis,19,36,22,18,5
Chanel Oahu Parfum,Chanel,mandarin_orange papyrus cedar cedarwood neroli caramel,42,22,1,29,6
Montale Kobraa Sport,Montale,cashmeran yuzu passionfruit birch,16,14,9,8,53
Chanel Invictus Noir,Chanel,licorice raspberry pear,9,10,0,56,25
Nishane The One Eau de Parfum,Nishane,ginger cardamom sour_cherry ambergris agarwood blackberry,0,23,22,3,52
Bvlgari Coco Mademoiselle Donna,Bvlgari,mandarin apricot black_pepper plum grapefruit,35,8,22,4,31
Xerjoff Red Tobacco Night,Xerjoff,plum neroli ambroxan green_apple,11,33,9,9,38
Initio Parfums Invictus Eau de Parfum,Initio Parfums,plum nutmeg wax chocolate,10,9,29,30,22
Creed Intense Cafe Privé,Creed,pink_pepper chocolate vetiver rosewood,7,12,13,64,4
Mancera Bal dAfrique Privé,Mancera,iso_e_super blood_orange lime,35,46,6,5,8
Xerjoff Santal 33 Uomo,Xerjoff,oakmoss raspberry black_pepper birch apple,1,58,14,6,21
Jean Paul Gaultier Alexandria II Intense,Jean Paul Gaultier,black_cherry,8,5,8,10,69
Kilian Black Phantom Blanche,Kilian,peach cloves,5,7,55,6,27
Dolce & Gabbana La Nuit de L'Homme Donna,Dolce & Gabbana,plum patchouli yuzu pear,25,18,0,5,52
Roja Parfums Silver Mountain Water Cologne,Roja Parfums,tonka_bean yuzu rosewood petitgrain,26,14,4,48,8
Lancome Straight to Heaven Privé,Lancome,oakmoss guaiac_wood mandarin mango pear,26,47,5,8,14
Lancome Stronger With You Night,Lancome,iso_e_super cedarwood petitgrain cherry_liqueur brown_sugar praline blood_orange vetiver,23,18,3,37,19
Creed Ombre Leather Intense,Creed,marshmallow lavender patchouli cedar black_pepper praline,7,52,23,12,6
Gucci Silver Mountain Water Sport,Gucci,vanilla,2,7,7,76,8
Bvlgari Terre Blanche,Bvlgari,licorice vanilla blood_orange cloves,24,8,25,39,4
Gucci Percival Intense,Gucci,mandarin cinnamon plum anis blackberry,33,9,24,7,27
Xerjoff Straight to Heaven Extreme,Xerjoff,tonka_bean wax vetiver pear,2,12,10,17,59
Dior One Million Privé,Dior,cumin lime wax petitgrain,23,3,49,16,9
Xerjoff One Million Eau de Parfum,Xerjoff,papyrus cacao licorice cinnamon coriander dried_fruits pineapple,6,11,30,21,32
Kilian Stronger With You Blanche,Kilian,papyrus lavender raspberry ginger vetiver,2,44,18,9,27
Hermes Code Eau de Parfum,Hermes,papyrus lemon guaiac_wood mint agarwood pineapple,23,16,40,0,21
Chanel Oud Wood Extreme,Chanel,oakmoss patchouli neroli blood_orange anis,52,14,25,4,5
Dolce & Gabbana Oajan Gold,Dolce & Gabbana,papyrus mandarin nutmeg pink_pepper birch,28,15,49,8,0
Mancera Black Phantom Night,Mancera,papyrus orange cedarwood rosewood mint saffron tonka_bean caramel,46,15,14,24,1
Roja Parfums Scandal Donna,Roja Parfums,mandarin_orange lemon iso_e_super apple cinnamon coconut anis caramel,18,18,12,34,18
Maison Margiela Tobacco Vanille Blanche,Maison Margiela,patchouli yuzu chocolate lime sour_cherry coconut coriander cashmeran,23,14,15,22,26
Tom Ford Man Eau Fraiche,Tom Ford,patchouli amber lime blood_orange,50,28,0,17,5
Paco Rabanne Tobacco Vanille Uomo,Paco Rabanne,lemon oakmoss nutmeg petitgrain sage agarwood,29,44,18,4,5
Parfums de Marly Reflection Noir,Parfums de Marly,amberwood pepper cedar mint praline vanilla,6,48,14,28,4
Roja Parfums Ultra Male Elixir,Roja Parfums,green_apple marshmallow ginger brown_sugar,4,8,11,64,13
Lancome La Nuit de L'Homme Intense,Lancome,papyrus honey raspberry nutmeg chocolate coriander,3,12,24,44,17
Hermes Hacivat Uomo,Hermes,lemon wax raspberry neroli ebony_wood ambergris caramel,16,32,6,18,28
Nishane Roses Vanille Sport,Nishane,mandarin_orange papyrus amberwood honey mandarin oud bourbon_vanilla,68,12,8,11,1
Bvlgari Good Girl,Bvlgari,pepper chocolate yuzu melon peach ambergris praline vetiver cashmeran,35,15,15,13,22
Chanel Soleil Blanc Extreme,Chanel,coffee chocolate ambergris pineapple,8,60,1,13,18
Jean Paul Gaultier Bal dAfrique Elixir,Jean Paul Gaultier,passionfruit wax orange amber rosewood fig neroli cashmeran,19,44,7,13,17
Chanel Libre Limited Edition,Chanel,wax ambroxan apricot ebony_wood praline vetiver,2,15,10,55,18
Bvlgari Aventus Uomo,Bvlgari,amberwood marshmallow petitgrain licorice neroli ebony_wood,32,42,4,19,3
Initio Parfums Interlude Absolute,Initio Parfums,mandarin_orange marshmallow cedarwood rosewood pear,13,16,4,22,45
Bvlgari Good Girl Sport,Bvlgari,cacao guaiac_wood lavender ginger birch,5,59,11,24,1
Versace Ani Night,Versace,nutmeg cacao marshmallow cardamom,9,8,19,63,1
Hermes Naxos Extreme,Hermes,pear mandarin,42,3,8,8,39
Paco Rabanne Libre Parfum,Paco Rabanne,lemon sandalwood guaiac_wood pink_pepper licorice peach caramel,17,13,15,19,36
Hermes Jadore Gold,Hermes,orange chocolate amber oakmoss,37,36,5,15,7
Roja Parfums Black Phantom Extreme,Roja Parfums,papyrus sandalwood raspberry green_apple coriander ambergris,10,38,16,2,34
Roja Parfums Alien Gold,Roja Parfums,apricot grapefruit,36,9,0,3,52
Tom Ford Light Blue Sport,Tom Ford,amberwood lemon ambroxan green_apple agarwood,16,61,1,2,20
Gucci Percival Elixir,Gucci,wax orange coffee ebony_wood cashmeran,45,28,7,12,8
Creed Light Blue Privé,Creed,papyrus wax guaiac_wood pink_pepper,5,70,14,11,0
Xerjoff Reflection Cologne,Xerjoff,passionfruit black_cherry cedarwood yuzu ambergris vanilla,40,12,3,28,17
Initio Parfums Neroli Portofino Noir,Initio Parfums,mandarin_orange lemon sage cashmeran caramel,13,42,19,19,7
Roja Parfums Le Male Parfum,Roja Parfums,amberwood passionfruit oud ebony_wood caramel,7,38,8,34,13
Hermes Hacivat Limited Edition,Hermes,mandarin_orange guaiac_wood mandarin oud plum praline birch apple,11,32,2,17,38
Parfums de Marly Aventus,Parfums de Marly,cinnamon bourbon_vanilla cherry_liqueur rosewood,1,28,20,20,31
Tom Ford Gypsy Water Gold,Tom Ford,orange dried_fruits ambroxan pineapple,17,24,9,0,50
Giorgio Armani Hypnotic Poison Night,Giorgio Armani,mango yuzu marshmallow blackcurrant,11,6,5,50,28
Parfums de Marly Millessime Imperial Night,Parfums de Marly,guaiac_wood cedarwood anis birch,1,23,64,8,4
Yves Saint Laurent Herod Extreme,Yves Saint Laurent,amberwood pepper patchouli blackcurrant ebony_wood,0,28,17,3,52
Dolce & Gabbana Tygar Limited Edition,Dolce & Gabbana,nutmeg amber pear cinnamon caramel,7,6,43,28,16
Tom Ford Ultra Male Uomo,Tom Ford,saffron oud dried_fruits cloves,3,34,43,3,17
Initio Parfums Crystal Noir Sport,Initio Parfums,iso_e_super patchouli cardamom lime neroli ambergris,16,41,39,2,2
Dior La Nuit de L'Homme Noir,Dior,black_cherry oakmoss guaiac_wood cedarwood black_pepper blackcurrant tonka_bean,7,12,26,37,18
