name,brand,notes,citrus,woody,fresh_spicy,sweet,fruity
Jean Paul Gaultier Fucking Fabulous Limited Edition,Jean Paul Gaultier,papyrus neroli lemon sandalwood,50,36,6,6,2
Jean Paul Gaultier La Vie Est Belle Night,Jean Paul Gaultier,honey ambergris ginger,0,38,39,19,4
Kilian Side Effect Privé,Kilian,honey sandalwood orange coffee ambergris birch,38,45,2,12,3
Gucci Millessime Imperial Eau de Parfum,Gucci,cacao lemon sandalwood mandarin coffee cedarwood ginger melon saffron agarwood,35,13,14,26,12
Mancera Le Male Uomo,Mancera,cacao lemon apricot amber black_pepper petitgrain,28,5,12,21,34
Prada Baccarat Rouge Blanche,Prada,iso_e_super lime fig agarwood cashmeran cloves,17,28,23,5,27
Xerjoff Good Girl Privé,Xerjoff,oakmoss raspberry mandarin,24,26,9,7,34
Parfums de Marly Black Phantom Parfum,Parfums de Marly,orange papyrus cardamom coriander,14,19,52,10,5
Dior Dylan Blue Extreme,Dior,mandarin_orange cardamom blackcurrant bergamot pink_pepper fig vetiver,17,34,33,1,15
Dolce & Gabbana Carlisle Parfum,Dolce & Gabbana,orange honey petitgrain,61,9,6,19,5
Lancome Fucking Fabulous Limited Edition,Lancome,sour_cherry cardamom blackberry caramel,4,6,42,37,11
Kilian Sedley Cologne,Kilian,passionfruit iso_e_super sandalwood blackcurrant petitgrain sichuan_pepper,18,14,52,2,14
Dior Carlisle Donna,Dior,papyrus honey iso_e_super blood_orange anis birch,14,25,41,14,6
Dior Galloway,Dior,lavender cedar yuzu apricot petitgrain cashmeran,29,28,11,3,29
Gucci Alien Uomo,Gucci,green_apple cloves,8,9,52,10,21
Nishane L'Homme,Nishane,pepper sichuan_pepper ebony_wood dried_fruits birch,1,13,49,8,29
Parfums de Marly Lost Cherry Intense,Parfums de Marly,cedar marshmallow praline,6,19,9,66,0
Gucci Gyan Privé,Gucci,coffee apricot cedarwood sour_cherry bourbon_vanilla,8,27,3,46,16
Paco Rabanne Le Male Night,Paco Rabanne,nutmeg lime petitgrain ambergris cashmeran,26,33,33,3,5
Bvlgari Dylan Blue Eau de Parfum,Bvlgari,mandarin_orange raspberry cinnamon saffron agarwood,12,24,32,6,26
Kilian Layton Limited Edition,Kilian,pink_pepper nutmeg yuzu marshmallow,19,4,15,62,0
Paco Rabanne Love Dont Be Shy Elixir,Paco Rabanne,orange black_pepper pink_pepper neroli peach apple,18,4,28,4,46
Kilian Code Intense,Kilian,mandarin_orange amberwood coffee orange sour_cherry bourbon_vanilla,13,40,7,13,27
Byredo Man Eau Fraiche Extreme,Byredo,papyrus licorice,0,67,3,22,8
Kilian Lost Cherry Absolute,Kilian,saffron oud sandalwood green_apple,10,16,39,10,25
Maison Margiela Galloway Uomo,Maison Margiela,amberwood sandalwood lime caramel peach grapefruit birch cloves,28,20,22,14,16
Jean Paul Gaultier Jubilation Donna,Jean Paul Gaultier,pink_pepper tonka_bean coconut coriander,6,10,11,24,49
Montale Tygar Absolute,Montale,sour_cherry oakmoss raspberry brown_sugar,7,12,7,58,16
Creed La Nuit de L'Homme Uomo,Creed,lime sage cinnamon bourbon_vanilla plum,25,4,42,15,14
Jean Paul Gaultier Tygar Night,Jean Paul Gaultier,neroli sichuan_pepper grapefruit praline anis,43,8,13,35,1
Byredo Herod Limited Edition,Byredo,papyrus bergamot petitgrain plum pineapple,37,30,5,2,26
Lancome Black Orchid Blanche,Lancome,sandalwood oakmoss yuzu neroli brown_sugar caramel,28,32,8,25,7
Giorgio Armani Oahu,Giorgio Armani,mandarin_orange yuzu praline,26,9,5,57,3
Jean Paul Gaultier Gyan Uomo,Jean Paul Gaultier,papyrus black_cherry mandarin yuzu sage bourbon_vanilla melon tonka_bean ambergris,16,36,12,21,15
Versace Lost Cherry Privé,Versace,honey cacao lemon guaiac_wood raspberry nutmeg cedarwood pear cashmeran,14,28,27,12,19
Kilian Hacivat Cologne,Kilian,oakmoss cedar apricot cloves apple,1,42,30,0,27
Nishane Galloway Intense,Nishane,lemon pepper sour_cherry peach anis,53,3,27,3,14
Montale Lost Cherry Privé,Montale,mandarin_orange lemon ambroxan wax blackcurrant brown_sugar apple,31,30,1,18,20
Gucci Invictus Night,Gucci,neroli blood_orange ebony_wood pear,28,20,3,7,42
Jean Paul Gaultier Green Irish Tweed Donna,Jean Paul Gaultier,passionfruit sandalwood wax sage licorice sour_cherry ebony_wood agarwood cloves,0,14,49,26,11
Bvlgari Scandal Privé,Bvlgari,mandarin_orange pink_pepper black_pepper mandarin,45,9,34,3,9
Bvlgari Lost Cherry Eau de Parfum,Bvlgari,mandarin_orange honey amber cardamom blood_orange pineapple,37,5,28,15,15
Bvlgari Rehab Extreme,Bvlgari,yuzu lime caramel,20,10,0,70,0
Dior Pegasus Elixir,Dior,honey wax orange patchouli ambergris,26,35,10,21,8
Nishane Erba Pura Intense,Nishane,cacao mandarin orange nutmeg brown_sugar peach birch,11,42,19,14,14
Roja Parfums L'Homme Eau de Parfum,Roja Parfums,passionfruit lemon oakmoss patchouli blackcurrant sichuan_pepper agarwood,21,17,11,0,51
Gucci Fucking Fabulous Limited Edition,Gucci,coffee cedarwood bergamot petitgrain sour_cherry bourbon_vanilla mint,12,35,23,14,16
Parfums de Marly Good Girl Elixir,Parfums de Marly,papyrus honey lemon guaiac_wood mango oud neroli,19,32,1,25,23
Mancera Intense Cafe Donna,Mancera,mandarin_orange papyrus marshmallow guaiac_wood vanilla,41,27,0,29,3
Prada Tuscan Leather Gold,Prada,caramel lime petitgrain,43,9,3,44,1
Tom Ford Gypsy Water Extreme,Tom Ford,mango lime fig neroli sichuan_pepper,16,6,13,9,56
Kilian Percival Donna,Kilian,cacao ambroxan guaiac_wood plum praline,8,14,7,15,56
Xerjoff Acqua Di Gio Uomo,Xerjoff,lemon amber rosewood licorice cashmeran,21,29,3,46,1
Chanel Sedley Night,Chanel,pink_pepper ambergris lemon apple,36,18,26,7,13
Byredo Ani,Byredo,chocolate yuzu bergamot cherry_liqueur vanilla apple,64,2,5,15,14
Giorgio Armani Carlisle,Giorgio Armani,papyrus honey passionfruit mandarin cedar lime blackberry cumin vetiver,24,16,34,13,13
Maison Margiela One Million Privé,Maison Margiela,honey oakmoss nutmeg agarwood apple,8,22,19,20,31
Gucci Crystal Noir Intense,Gucci,oakmoss black_pepper pear petitgrain grapefruit,22,36,22,2,18
Chanel Alexandria II Cologne,Chanel,agarwood tonka_bean grapefruit,52,13,8,18,9
Lancome Carlisle Gold,Lancome,mandarin_orange patchouli licorice petitgrain,27,22,8,36,7
Dior Eros Parfum,Dior,ambergris oud apple caramel,3,37,4,30,26
Amouage Side Effect Blanche,Amouage,honey lavender cedar bergamot cinnamon melon agarwood,13,14,19,19,35
Xerjoff Interlude Sport,Xerjoff,tonka_bean lavender pepper sour_cherry,9,3,17,40,31
Paco Rabanne Oud for Greatness Cologne,Paco Rabanne,cedarwood yuzu wax mandarin,31,17,6,44,2
Initio Parfums Ombre Leather Gold,Initio Parfums,amberwood mint vetiver rosewood,4,12,68,6,10
Prada Terre Night,Prada,passionfruit lemon iso_e_super blackcurrant coriander saffron praline,27,20,14,21,18
Nishane Acqua Di Gio Cologne,Nishane,plum nutmeg tonka_bean apple,0,7,14,52,27
Gucci Fucking Fabulous Sport,Gucci,vanilla brown_sugar ambroxan cumin,7,16,49,27,1
Initio Parfums Kobraa Absolute,Initio Parfums,papyrus guaiac_wood oud lime petitgrain,17,72,5,6,0
Yves Saint Laurent L'Homme Extreme,Yves Saint Laurent,cinnamon cedarwood agarwood sour_cherry,10,19,35,1,35
Dolce & Gabbana Green Irish Tweed Eau de Parfum,Dolce & Gabbana,papyrus cacao passionfruit lemon sandalwood sour_cherry cinnamon agarwood cloves,19,15,19,16,31
Lancome Grey Vetiver Uomo,Lancome,honey sandalwood yuzu licorice anis,23,19,41,13,4
Prada Black Phantom Noir,Prada,mandarin_orange coconut ebony_wood grapefruit pineapple,50,13,8,3,26
Mancera Grey Vetiver Extreme,Mancera,chocolate cacao sichuan_pepper sour_cherry,0,6,30,20,44
Initio Parfums Code Gold,Initio Parfums,amberwood pineapple rosewood pear,3,63,2,9,23
Creed Ani Gold,Creed,iso_e_super oakmoss lime neroli coriander saffron praline vetiver,16,33,24,20,7
Amouage Crystal Noir Noir,Amouage,bourbon_vanilla vanilla sage,2,8,55,35,0
Bvlgari Code Blanche,Bvlgari,chocolate cedarwood mint cumin,9,53,17,15,6
Montale Roses Vanille Parfum,Montale,guaiac_wood mandarin patchouli lime vetiver,45,33,3,9,10
Chanel Herod Night,Chanel,oud sage bergamot bourbon_vanilla plum,23,16,22,23,16
Nishane Love Dont Be Shy Elixir,Nishane,pink_pepper sichuan_pepper blackcurrant mandarin,19,2,55,2,22
Xerjoff Oahu Noir,Xerjoff,ginger lemon,54,5,34,0,7
Nishane Interlude Elixir,Nishane,ambroxan guaiac_wood orange pear coconut,27,38,0,5,30
Chanel Sedley,Chanel,mandarin black_pepper sichuan_pepper ambergris apple,16,41,13,7,23
Mancera Pegasus Blanche,Mancera,papyrus oakmoss guaiac_wood lime sour_cherry neroli,50,27,7,2,14
Giorgio Armani Bal dAfrique Night,Giorgio Armani,honey oud black_pepper coriander brown_sugar cashmeran apple,1,21,30,37,11
Bvlgari Spicebomb Donna,Bvlgari,marshmallow iso_e_super passionfruit patchouli cedarwood peach grapefruit vanilla,18,38,6,13,25
Dolce & Gabbana Terre Noir,Dolce & Gabbana,iso_e_super patchouli cedarwood amber coriander,5,13,65,14,3
Dolce & Gabbana Neroli Portofino Parfum,Dolce & Gabbana,nutmeg lavender sour_cherry,4,7,33,6,50
Byredo Good Girl Privé,Byredo,mandarin,74,3,10,6,7
Roja Parfums By the Fireplace Elixir,Roja Parfums,yuzu cardamom blood_orange raspberry,44,9,19,10,18
Roja Parfums The One Privé,Roja Parfums,papyrus orange cedarwood oud bergamot coconut,53,11,1,0,35
Paco Rabanne Percival Cologne,Paco Rabanne,ambroxan cedar cinnamon coriander agarwood,5,16,76,1,2
Bvlgari Straight to Heaven Uomo,Bvlgari,wax rosewood pink_pepper neroli coriander ambergris pineapple,18,15,11,24,32
Initio Parfums Kobraa,Initio Parfums,mandarin_orange black_pepper pear neroli birch,20,11,32,9,28
Nishane Straight to Heaven Cologne,Nishane,iso_e_super lemon pepper bergamot coriander ambergris,48,28,13,8,3
Xerjoff Millessime Imperial Noir,Xerjoff,nutmeg yuzu cardamom,24,2,66,6,2
Mancera Intense Cafe Parfum,Mancera,orange apricot ginger green_apple,29,7,15,3,46
Amouage Tuscan Leather Absolute,Amouage,sour_cherry sichuan_pepper wax caramel,8,2,28,19,43
Tom Ford Tobacco Vanille Sport,Tom Ford,lemon oakmoss guaiac_wood cedarwood yuzu pear,14,18,4,6,58
Kilian Neroli Portofino Intense,Kilian,mandarin_orange papyrus cacao chocolate cardamom lime rosewood blackcurrant coconut sichuan_pepper,14,18,24,27,17
Prada Coco Mademoiselle Elixir,Prada,patchouli lemon anis sour_cherry,34,21,27,6,12
Versace Light Blue Parfum,Versace,papyrus wax licorice neroli apple,12,11,0,22,55
Byredo Mojave Ghost Limited Edition,Byredo,mandarin_orange oakmoss guaiac_wood cedar bergamot green_apple dried_fruits,14,31,3,2,50
Tom Ford Jubilation Uomo,Tom Ford,oakmoss guaiac_wood mango rosewood saffron,1,36,28,9,26
Maison Margiela Neroli Portofino Intense,Maison Margiela,cedar cedarwood cardamom,1,41,48,9,1
Amouage Neroli Portofino Elixir,Amouage,orange yuzu sichuan_pepper,16,8,64,5,7
Gucci Sauvage Elixir,Gucci,passionfruit anis petitgrain mint vanilla,11,3,21,54,11
Chanel Interlude Privé,Chanel,guaiac_wood cardamom fig coconut sichuan_pepper,10,13,26,10,41
Xerjoff Alexandria II Privé,Xerjoff,amberwood lemon sandalwood coffee cedarwood brown_sugar blood_orange,15,67,2,13,3
Parfums de Marly Love Dont Be Shy Extreme,Parfums de Marly,lemon pepper blackcurrant green_apple tonka_bean,37,6,16,25,16
Parfums de Marly Good Girl Night,Parfums de Marly,amber brown_sugar saffron agarwood vetiver,5,11,14,63,7
Byredo One Million Sport,Byredo,passionfruit blood_orange pineapple mandarin,46,6,4,9,35
Yves Saint Laurent Sedley Night,Yves Saint Laurent,caramel mandarin,42,3,5,45,5
Tom Ford Light Blue Cologne,Tom Ford,mint coconut,1,6,64,10,19
Gucci Soleil Blanc Privé,Gucci,honey oakmoss guaiac_wood coffee rosewood green_apple mint anis,1,20,13,15,51
Roja Parfums Straight to Heaven Extreme,Roja Parfums,guaiac_wood cedarwood ginger pink_pepper ambergris grapefruit blood_orange,37,28,25,4,6
Mancera Sauvage Donna,Mancera,wax guaiac_wood raspberry yuzu lime blackcurrant sichuan_pepper cumin agarwood,13,47,16,13,11
Jean Paul Gaultier Sedley Gold,Jean Paul Gaultier,ambroxan guaiac_wood orange green_apple pink_pepper mint blood_orange,38,29,20,0,13
Initio Parfums Reflection Intense,Initio Parfums,marshmallow ginger cinnamon brown_sugar blood_orange,46,5,33,15,1
Giorgio Armani Crystal Noir,Giorgio Armani,iso_e_super wax patchouli cedarwood coconut,8,41,4,22,25
Roja Parfums Tygar Limited Edition,Roja Parfums,amberwood cacao marshmallow oakmoss patchouli ginger pear,9,27,23,30,11
Maison Margiela Terre Noir,Maison Margiela,bourbon_vanilla black_cherry melon rosewood,5,15,5,26,49
Versace Lost Cherry Noir,Versace,mandarin_orange black_cherry lavender mandarin green_apple sichuan_pepper vanilla,17,6,27,17,33
Montale La Nuit de L'Homme Night,Montale,lemon oakmoss iso_e_super blackcurrant saffron vetiver,53,13,12,2,20
Prada Tuscan Leather Cologne,Prada,ginger oakmoss rosewood sage,6,42,37,10,5
Yves Saint Laurent Fucking Fabulous Gold,Yves Saint Laurent,agarwood iso_e_super black_pepper cloves,5,77,11,3,4
Byredo Layton Eau de Parfum,Byredo,cedar lime ambroxan mandarin,48,32,8,5,7
Dolce & Gabbana Kobraa Uomo,Dolce & Gabbana,nutmeg cedar pear agarwood vetiver blackberry,0,37,40,4,19
Byredo Gypsy Water Blanche,Byredo,pink_pepper plum cardamom rosewood,3,21,34,8,34
Yves Saint Laurent Herod Donna,Yves Saint Laurent,orange oakmoss pear,12,50,2,10,26
Byredo Libre Blanche,Byredo,coffee pepper vetiver sage,4,15,52,21,8
Roja Parfums L'Homme Cologne,Roja Parfums,iso_e_super pepper patchouli coconut ebony_wood,7,37,35,6,15
Gucci Sauvage Eau de Parfum,Gucci,saffron cinnamon honey bergamot,19,6,28,44,3
Roja Parfums Eros Gold,Roja Parfums,passionfruit lavender mandarin petitgrain licorice fig sichuan_pepper praline,11,2,39,26,22
Maison Margiela Good Girl Eau de Parfum,Maison Margiela,lemon apricot cardamom petitgrain sichuan_pepper praline,14,2,52,13,19
Lancome Hacivat Noir,Lancome,sandalwood raspberry petitgrain coconut ebony_wood saffron ambergris anis,13,38,11,1,37
Roja Parfums Interlude Absolute,Roja Parfums,black_cherry sichuan_pepper anis pear,4,10,23,8,55
Prada Bal dAfrique Extreme,Prada,sandalwood orange cedar lime bourbon_vanilla sichuan_pepper cumin,17,37,29,16,1
Yves Saint Laurent Accento Night,Yves Saint Laurent,amberwood honey marshmallow iso_e_super black_pepper anis,10,14,50,19,7
Montale Carlisle Privé,Montale,lemon cedarwood petitgrain licorice coriander,49,17,11,21,2
Xerjoff Gypsy Water Intense,Xerjoff,plum anis cashmeran fig,1,31,40,7,21
Giorgio Armani Roses Vanille Eau de Parfum,Giorgio Armani,amberwood patchouli oud bourbon_vanilla grapefruit blackberry,22,36,5,20,17
Amouage No 5 Eau de Parfum,Amouage,ambroxan mandarin orange cardamom ebony_wood anis blackberry,25,16,14,9,36
Nishane Grey Vetiver Night,Nishane,pink_pepper cedar cedarwood patchouli,6,68,16,8,2
Hermes Mojave Ghost Donna,Hermes,honey lemon cedar cardamom licorice ebony_wood cumin ambergris,42,12,17,19,10
Hermes Libre Uomo,Hermes,oud rosewood pear neroli mint melon cumin grapefruit,40,26,19,4,11
Amouage Spicebomb Noir,Amouage,pink_pepper peach blood_orange anis,31,3,23,10,33
Maison Margiela Oud Wood Noir,Maison Margiela,passionfruit orange bergamot agarwood birch cashmeran,24,26,9,5,36
Kilian Spicebomb Uomo,Kilian,raspberry oud cinnamon mint melon,3,65,13,1,18
Chanel Oud for Greatness Blanche,Chanel,cacao petitgrain dried_fruits blood_orange blackberry,38,6,9,28,19
Dolce & Gabbana Tobacco Vanille Intense,Dolce & Gabbana,amberwood honey iso_e_super pineapple black_pepper saffron vanilla birch,3,46,11,27,13
Gucci Aventus Sport,Gucci,cacao cedar yuzu black_pepper rosewood cinnamon cashmeran,26,45,16,11,2
Xerjoff Black Orchid Donna,Xerjoff,mandarin_orange cacao lemon licorice pink_pepper,43,10,30,17,0
Tom Ford Love Dont Be Shy Intense,Tom Ford,patchouli oud rosewood mint coconut,5,18,16,5,56
Montale Hacivat,Montale,mandarin_orange lemon guaiac_wood sage pink_pepper sour_cherry peach,49,17,16,4,14
Gucci Good Girl,Gucci,neroli vetiver raspberry,14,22,6,6,52
Hermes Noir Extreme,Hermes,patchouli oakmoss ebony_wood,3,93,2,0,2
Amouage Oud Wood Limited Edition,Amouage,cacao ebony_wood brown_sugar birch cloves,4,19,42,26,9
Nishane Light Blue Cologne,Nishane,licorice amber blackberry fig,7,9,4,11,69
Mancera Carlisle Privé,Mancera,lavender mandarin coffee apricot cumin grapefruit praline,19,4,13,11,53
Creed No 5 Privé,Creed,patchouli cinnamon,9,23,54,5,9
Tom Ford Herod Uomo,Tom Ford,chocolate grapefruit dried_fruits wax,40,3,1,37,19
Jean Paul Gaultier Red Tobacco,Jean Paul Gaultier,honey mango petitgrain coconut ambergris caramel,30,29,5,21,15
Nishane Oahu Blanche,Nishane,papyrus cacao chocolate sage cashmeran,8,12,43,30,7
Lancome L'Homme Cologne,Lancome,marshmallow iso_e_super wax raspberry cedarwood ginger cherry_liqueur vetiver,1,13,32,13,41
Byredo Fan Your Flames Noir,Byredo,amberwood honey lavender cedarwood brown_sugar saffron agarwood,9,27,23,33,8
Mancera Libre Cologne,Mancera,licorice wax blackcurrant green_apple,7,2,9,67,15
Amouage Oud Noir Intense,Amouage,sandalwood black_cherry pink_pepper ebony_wood peach vanilla caramel,2,26,25,16,31
Yves Saint Laurent Man Eau Fraiche Night,Yves Saint Laurent,sage lime birch bergamot,43,31,12,8,6
Mancera Man Eau Fraiche Cologne,Mancera,iso_e_super cardamom coconut cherry_liqueur saffron birch,7,40,34,2,17
Yves Saint Laurent Green Irish Tweed Eau de Parfum,Yves Saint Laurent,black_cherry ambroxan guaiac_wood patchouli licorice,7,12,3,16,62
Chanel Versace Pour Homme Donna,Chanel,cacao sandalwood oakmoss cashmeran,6,36,9,48,1
Byredo Oahu Intense,Byredo,dried_fruits orange yuzu licorice pink_pepper praline anis,11,8,28,34,19
Versace Jadore Parfum,Versace,cacao sandalwood wax apricot black_pepper cinnamon,1,38,12,15,34
Amouage Percival Cologne,Amouage,rosewood bergamot tonka_bean birch vetiver,20,18,0,61,1
Versace Side Effect Elixir,Versace,peach patchouli wax black_pepper,9,37,13,16,25
Amouage Cedrat Boise Sport,Amouage,cacao cedarwood oud lime agarwood vanilla,15,31,0,50,4
Montale Noir Extreme Sport,Montale,lemon coffee cardamom cinnamon brown_sugar,22,8,37,27,6
Gucci Code Sport,Gucci,praline lemon ambroxan cashmeran,66,13,3,16,2
Jean Paul Gaultier Y Le Parfum Night,Jean Paul Gaultier,honey ambroxan oakmoss cedarwood lime brown_sugar,52,13,3,28,4
Parfums de Marly Hacivat Limited Edition,Parfums de Marly,blood_orange petitgrain,83,7,4,5,1
Initio Parfums Lost Cherry Noir,Initio Parfums,raspberry apricot birch caramel,5,36,8,24,27
Xerjoff Oajan Night,Xerjoff,iso_e_super sandalwood nutmeg licorice cumin vetiver,9,27,22,40,2
Bvlgari Gypsy Water,Bvlgari,cedar amber neroli brown_sugar ambergris birch,32,17,6,40,5
Roja Parfums Spicebomb Extreme,Roja Parfums,mandarin_orange sandalwood cinnamon brown_sugar vetiver,31,29,24,14,2
Chanel Man Eau Fraiche Night,Chanel,amberwood honey sandalwood wax coconut cashmeran,10,39,4,27,20
Byredo Invictus,Byredo,amberwood passionfruit mandarin patchouli chocolate ginger rosewood sour_cherry coriander,17,17,26,18,22
Versace Sauvage Blanche,Versace,lavender ambroxan cashmeran,8,25,53,10,4
Yves Saint Laurent Fan Your Flames Eau de Parfum,Yves Saint Laurent,amberwood pepper coffee apricot rosewood neroli cherry_liqueur,12,20,35,17,16
Amouage Santal 33 Elixir,Amouage,honey ginger lime pear,15,2,13,38,32
Lancome Cedrat Boise Absolute,Lancome,sandalwood cloves guaiac_wood bergamot,48,11,30,8,3
Dior Rehab Limited Edition,Dior,black_cherry cedar cherry_liqueur agarwood birch,0,58,1,8,33
Montale Bright Crystal Privé,Montale,oakmoss cedarwood licorice bourbon_vanilla peach,2,34,6,46,12
Byredo Invictus Gold,Byredo,blackcurrant anis blackberry cumin,10,2,37,0,51
Chanel Lost Cherry Elixir,Chanel,mango caramel pepper cloves,3,8,32,15,42
Byredo L'Homme Night,Byredo,passionfruit iso_e_super patchouli cinnamon coconut anis,8,31,37,8,16
Prada Tobacco Vanille Parfum,Prada,sandalwood coffee nutmeg mango petitgrain pink_pepper brown_sugar ambergris birch apple,11,15,37,24,13
Maison Margiela Tygar Intense,Maison Margiela,mango dried_fruits pepper mandarin,47,4,14,0,35
Chanel Sedley Privé,Chanel,papyrus neroli vetiver,47,30,6,8,9
Xerjoff Hacivat Eau de Parfum,Xerjoff,mandarin_orange papyrus marshmallow lavender sichuan_pepper ambergris agarwood blood_orange,46,15,18,12,9
Byredo Eros Sport,Byredo,praline iso_e_super ebony_wood caramel,5,30,10,52,3
Roja Parfums Mojave Ghost Night,Roja Parfums,bourbon_vanilla lemon oakmoss mandarin,24,44,10,13,9
Mancera Erba Pura Intense,Mancera,black_cherry ambroxan chocolate petitgrain melon,45,12,6,26,11
Initio Parfums Green Irish Tweed Donna,Initio Parfums,cacao chocolate mango pear neroli birch,17,19,1,42,21
Parfums de Marly Lost Cherry Uomo,Parfums de Marly,guaiac_wood cardamom lime pear mint tonka_bean grapefruit cashmeran caramel,11,38,12,24,15
Yves Saint Laurent Red Tobacco Eau de Parfum,Yves Saint Laurent,patchouli grapefruit vanilla black_pepper,43,24,17,16,0
Bvlgari Bleu Cologne,Bvlgari,cacao passionfruit pink_pepper melon brown_sugar,3,10,12,26,49
Creed Bal dAfrique Uomo,Creed,black_cherry iso_e_super sage brown_sugar praline,7,18,20,39,16
Dior Reflection Limited Edition,Dior,sandalwood chocolate oud ginger neroli cumin,17,18,36,25,4
Paco Rabanne Man Eau Fraiche Noir,Paco Rabanne,nutmeg yuzu ginger caramel,23,5,16,54,2
Roja Parfums Layton,Roja Parfums,mandarin_orange cedar rosewood bergamot,36,53,7,1,3
Montale La Nuit de L'Homme Sport,Montale,honey wax cedarwood coriander anis pineapple,3,22,37,23,15
Montale Intense Cafe Absolute,Montale,papyrus sandalwood lime sage cashmeran,17,51,15,10,7
Montale Neroli Portofino,Montale,marshmallow guaiac_wood chocolate apricot plum,9,28,5,43,15
Nishane Spicebomb Absolute,Nishane,mandarin_orange oakmoss cedar black_pepper ebony_wood blood_orange,23,56,11,1,9
Gucci Good Girl Eau de Parfum,Gucci,papyrus cacao sage neroli tonka_bean,33,15,29,23,0
Yves Saint Laurent Cedrat Boise Privé,Yves Saint Laurent,mandarin_orange amberwood ambroxan oud cardamom green_apple sichuan_pepper pineapple,14,31,26,5,24
Montale Gypsy Water Extreme,Montale,ambroxan yuzu rosewood petitgrain mint ambergris anis,56,15,16,7,6
Byredo Sedley Sport,Byredo,marshmallow mandarin coffee cedarwood bergamot ebony_wood,47,25,1,27,0
Paco Rabanne Bleu Parfum,Paco Rabanne,mandarin green_apple cherry_liqueur praline vanilla,25,7,2,50,16
Prada Hacivat Privé,Prada,cacao sandalwood ginger bourbon_vanilla ebony_wood,10,17,51,20,2
Byredo Oud Wood,Byredo,papyrus honey patchouli fig cherry_liqueur caramel,9,54,0,25,12
Kilian Carlisle Eau de Parfum,Kilian,cumin nutmeg coconut petitgrain,11,8,12,3,66
Initio Parfums Erba Pura Sport,Initio Parfums,marshmallow passionfruit mandarin cedar bourbon_vanilla peach ambergris,36,13,3,26,22
Dolce & Gabbana Roses Vanille Intense,Dolce & Gabbana,yuzu petitgrain pink_pepper ebony_wood anis,31,31,26,4,8
Chanel Oajan Uomo,Chanel,mandarin_orange pepper oud coriander tonka_bean ambergris vetiver,23,17,29,23,8
Gucci Scandal Donna,Gucci,oud marshmallow,6,21,2,62,9
Dolce & Gabbana Invictus Extreme,Dolce & Gabbana,ambergris cardamom ebony_wood,4,55,23,8,10
Creed Black Opium Parfum,Creed,lemon sandalwood oakmoss cedar apricot sour_cherry,44,37,2,1,16
Gucci Santal 33 Limited Edition,Gucci,iso_e_super patchouli bergamot grapefruit praline caramel,19,19,5,54,3
Amouage Dylan Blue Uomo,Amouage,amberwood marshmallow apricot cedarwood cardamom bergamot petitgrain coconut coriander brown_sugar,25,21,17,13,24
Montale No 5 Uomo,Montale,black_cherry yuzu mint sichuan_pepper melon,18,9,39,7,27
Versace Roses Vanille Elixir,Versace,black_cherry sandalwood ambroxan cedarwood peach blood_orange,33,42,4,9,12
Initio Parfums Bright Crystal Uomo,Initio Parfums,amberwood patchouli cedarwood sage blackberry apple,10,34,31,3,22
Byredo Alien Uomo,Byredo,agarwood cloves cherry_liqueur cumin,9,19,32,3,37
Prada Oud for Greatness Donna,Prada,mandarin_orange black_pepper pink_pepper blood_orange plum vanilla,25,7,16,33,19
Tom Ford Angels Share Limited Edition,Tom Ford,mandarin_orange amberwood passionfruit sour_cherry grapefruit vanilla birch,34,18,5,20,23
Tom Ford Ani Eau de Parfum,Tom Ford,orange vanilla blood_orange cumin,18,8,35,32,7
Amouage Le Beau Donna,Amouage,raspberry pepper mandarin,41,6,27,6,20
Montale Sauvage Limited Edition,Montale,yuzu sour_cherry sichuan_pepper ebony_wood melon grapefruit,18,24,16,10,32
Creed No 5 Eau de Parfum,Creed,ebony_wood melon plum agarwood vanilla cloves,2,29,12,30,27
Roja Parfums La Nuit de L'Homme Cologne,Roja Parfums,mango agarwood cherry_liqueur,2,33,2,5,58
Initio Parfums L'Homme Blanche,Initio Parfums,vanilla blackberry green_apple,0,4,8,52,36
Mancera Carlisle Uomo,Mancera,iso_e_super orange patchouli tonka_bean vanilla,23,58,4,14,1
Initio Parfums Rehab Sport,Initio Parfums,mandarin_orange oud sour_cherry,13,53,5,3,26
Dolce & Gabbana Alien Donna,Dolce & Gabbana,ambroxan ginger sage coconut pineapple,5,54,24,6,11
Yves Saint Laurent Sedley Extreme,Yves Saint Laurent,lemon pepper orange cedar rosewood pink_pepper coconut ebony_wood tonka_bean caramel,15,39,14,14,18
Dolce & Gabbana Noir Extreme Sport,Dolce & Gabbana,papyrus amberwood wax sour_cherry birch,6,39,10,15,30
Mancera Ultra Male Donna,Mancera,mandarin_orange passionfruit oakmoss coffee oud plum,17,33,2,21,27
Bvlgari Le Beau Parfum,Bvlgari,mandarin_orange ginger pink_pepper ebony_wood tonka_bean vanilla,35,25,29,11,0
Creed Straight to Heaven Privé,Creed,mandarin_orange papyrus licorice cumin tonka_bean agarwood birch,34,15,20,25,6
Montale Tobacco Vanille Absolute,Montale,guaiac_wood mandarin cedarwood cardamom blackcurrant bourbon_vanilla ambergris,14,29,28,12,17
Bvlgari Noir Extreme Blanche,Bvlgari,black_cherry wax yuzu pear cinnamon cloves,37,4,20,20,19
Jean Paul Gaultier Black Orchid Absolute,Jean Paul Gaultier,mandarin_orange orange apricot fig pink_pepper coriander,17,3,64,3,13
Initio Parfums L'Homme Donna,Initio Parfums,raspberry cedar pear cumin tonka_bean,10,16,49,13,12
Kilian Green Irish Tweed Privé,Kilian,papyrus cacao oakmoss petitgrain vanilla vetiver,33,35,9,15,8
Tom Ford Erba Pura Eau de Parfum,Tom Ford,amberwood honey lemon licorice blood_orange cashmeran,13,47,6,28,6
Versace Roses Vanille Intense,Versace,chocolate rosewood sage bergamot bourbon_vanilla grapefruit anis,12,22,38,24,4
